Name,Description,Social URLs,Phones,company_clean,Final Email
The Busy Box Moving,"The Busy Box Moving is a moving service based in Medford, Oregon, offering support for homes, apartments, and businesses throughout the relocation process. Their main functionalities include local and long-distance moving assistance, specialized services for office relocations, and comprehensive packing and transportation solutions. Key features include professional crews with trained professionals, organized route planning, protective equipment for delicate items, and transparent pricing that includes moving labor and fees. They cater to various needs such as family moves, senior living, and student relocations.",,,The Busy Box Moving,info@busyboxmoving.com
Campus Concierge,"Campus Concierge is an on-demand platform that connects college students with trusted classmates for various campus tasks, such as moving assistance, tutoring, and errands. Students can browse profiles of helpers based on their needs and preferences, ensuring a smooth hiring process without the need for upfront payments or lengthy wait times. The service allows users to earn money by providing help while maintaining community building through shared requests from peers.","https://www.linkedin.com/company/campus-concierge1, https://www.instagram.com/campusconcierge.cc, https://apps.apple.com/us/app/campus-concierge/id6752625127",,Campus Concierge,support@campusconcierge.cc
Cannon Moving & Storage Co.,"Cannon Moving & Storage is a moving company based in Clovis, New Mexico, offering local and long-distance moving services for both residential and commercial clients. Their main functionalities include packing, shipping, storage solutions, and providing expert packing and crating services. They also offer free estimates, employee background checks, and have access to reliable interstate moving agents to ensure smooth and timely service.",https://facebook.com/cannon-moving-and-storage-377174402681346,"+15757623949, +15757637766",Cannon Moving & Storage,sandy@cmsbekins.com
CargoPros,"CargoPros is a moving company that offers local and long-distance moving services in California. Their main functionalities include packing, heavy lifting, and specialized moving for seniors and high-value items. They are fully licensed and insured, ensuring customer safety and peace of mind through a background and drug test, and provide complimentary estimates to prospective clients. The process involves client communication, planning, and coordinating all aspects of the move, including packing, storage, and transportation.",,+18337893319,CargoPros,cross@cargo-pros.com
Carlson Brothers Movers,"Carlson Brothers Movers is a professional moving service based in Addison, Illinois, offering tailored solutions for homes, apartments, and businesses. Their main functionality includes providing skilled crews for various moves such as house relocations, office relocations (including furniture and heavy lifting), and long-distance relocation. Key features include free quotes, fully equipped trucks, customizable moving plans, and a focus on safety and transparency throughout the move process. They cater to different needs, including specialized services for students, seniors, and commercial clients, ensuring efficient logistics and support.",,,Carlson Brothers Movers,info@carlsonbrothersmovers.com
Carolina Relocation & Transition Specialists,"Carolina RTS is a moving assistance service based in Pittsboro, NC, specializing in senior moving support. They offer services such as downsizing, packing, and unpacking for individuals and families, as well as relocation assistance. The company provides 24/7 automated assistant support and emphasizes compassionate care throughout the moving process to ensure clients feel comfortable and secure during their transitions. Additionally, they offer complimentary consultations and tailored solutions to meet the specific needs of seniors.","https://www.linkedin.com/company/carolina-relocation-&-transition-specialists, https://www.facebook.com/carolinarts1","+13362100140, +13362133012, +19196101888",Carolina Relocation & Transition Specialists,tod@carolina-rts.com
Chatham Moving & Storage,"Chatham Storage is a moving and self-storage service based in Chatham, New Jersey. They offer a variety of storage options ranging from small to large units, allowing customers to rent them online or by phone. Key features include professional packing and crating services, video surveillance for security, and a commitment to customer service with open pricing and flexible rental plans. The company has over four decades of experience in the industry, providing accurate estimates and personalized assistance throughout the moving process.","https://www.linkedin.com/company/chatham-moving-&-storage, https://instagram.com/chathamstorage",+19736357100,Chatham Moving & Storage,info@chathamstorage.com
City Pro Movers Chula Vista,"City Pro Movers is a local moving company in San Diego that offers a variety of moving services for residential, commercial, and industrial moves. Their main functionalities include packing, storage, and heavy lifting assistance, ensuring a smooth relocation process for clients. With over 20 years of experience, they provide free quotes and emphasize safety and professionalism throughout the moving process.",,+18887773707,City Pro Movers Chula Vista,info@citypromovers.com
Helping Hands Moving Service,"Help Hands Moving Service is a local moving company based in Columbus, GA, offering residential and commercial moving solutions for both small and large moves. Their main services include long-distance moving, packing out services, hot tub moving, safe moving, and specialized piano move services. The company provides free estimates, thorough walkthroughs to understand moving timelines, and personalized customer support throughout the relocation process. They operate within the Columbus area and offer additional services such as packing assistance and insurance claims handling for insurance claims.",,+18337066683,Helping Hands Moving Service,mike@helpinghandsmovingservice.com
Corporate Office Installations,"COI is a office moving and installation company based in Boise, ID, specializing in various services for commercial office projects. They offer project management and consulting to assist with furniture installation, cleaning, storage, audio/visual installations, cubicles and partitions, and cabling coordination. COI also provides corporate office installations and maintenance programs tailored to client needs, ensuring efficient and effective space management throughout the office relocation process. Their facility includes over 60,000 square feet of storage and they handle all aspects of office renovations and repairs.","https://www.linkedin.com/company/corporate-office-installations, https://www.facebook.com/corporateofficeinstallations",+12089474004,Corporate Office Installations,mike@coi-boise.com
Country Club Moving & Packing Inc,"Country Club Moving is a moving company based in Memphis, TN, offering a range of services for families and businesses. They provide local, long-distance, apartment moves, commercial, student, senior relocations, and piano relocation. The company emphasizes personalized packing services, climate-controlled storage solutions, and transparent pricing with no hidden fees. Their team is licensed, bonded, and insured, ensuring efficient handling of the moving process and customer satisfaction.","https://www.linkedin.com/company/country-club-moving-inc-, https://www.facebook.com/countryclubmovingmemphis, https://www.instagram.com/ccmpinc, https://twitter.com/ccmpi, https://www.youtube.com/channel/UC1fFaJHMdDlfgEfAaGaAnvw, https://www.pinterest.com/memphismover/moving-services, https://www.yelp.com/biz/country-club-moving-and-packing-inc-memphis-2","+19017519611, +19018544477",Country Club Moving & Packing,colquettvandyke@gmail.com
Covered Wagon Moving,"Covered Wagon Moving is a moving company that offers residential and commercial relocation services in the greater Austin area. Their main functionality includes packing, transport, storage, and unloading for homes and businesses, as well as gun safes and piano storage. They focus on providing transparent pricing, professional customer service, and tailored solutions to meet individual client needs while ensuring efficient handling of belongings and minimizing downtime during moves.",https://www.facebook.com/pages/category/home-mover/covered-wagon-moving-153776834691063,,Covered Wagon Moving,chad@coveredwagonmoving.com
Crosstown Moving,"Crosstown Moving is a moving company based in Baytown, TX, offering a variety of moving services for residential and commercial clients. Their main functionalities include packing, unpacking, and storage, with options for last-minute moves and specialized services like apartment relocations, furniture move, and gym equipment relocation. Customers can request free estimates, schedule moving appointments, and receive assistance throughout the moving process, ensuring a smooth transition. The company is fully insured, holds BBB accreditation, and provides support for both local and long-distance moves.",https://www.facebook.com/p/crosstown-moving-100076188439615,+18887114778,Crosstown Moving,info@crosstownmovingtx.com
Crystal Lake Movers,"Crystal Lake Movers is a local moving company that offers a range of moving services for both residential and commercial moves. Their main functionality includes providing packing, storage, and general moving assistance tailored to the specific needs of clients. Key features include a flexible scheduling process, competitive pricing, customer support, and a satisfaction guarantee, ensuring a smooth and stress-free moving experience. They cater to various move types, including small offices and larger homes, and emphasize safety and professionalism throughout the relocation process.",,+18152402603,Crystal Lake Movers,info@crystallakemovers.com
Designed To Move MI LLC,"Designed To Move MI LLC is a family-owned moving company that provides residential and commercial relocation services across Michigan. They specialize in various moving types, including hot tub relocations, piano moving, box sales, and furniture move assistance. The company emphasizes customer satisfaction by offering flexible scheduling and packing services, ensuring safe and efficient relocation processes for both small and large moves. Their team consists of experienced movers who perform some moves themselves to enhance the overall moving experience.",,+15868049600,Designed To Move MI,jheight@d2moving.com
Dan The Moving Man,"Dan The Moving Man is a moving service specializing in the transportation and care of pianos, household goods, and other belongings. They offer free in-home estimates and have over 50 years of experience in the industry, ensuring careful packing and maintenance for sensitive instruments. In addition to moving services, they provide piano tuning, repair, and storage options, as well as sales and consignment opportunities for pianos. Their trained technicians focus on creating safe and efficient moves while maintaining high standards of customer satisfaction.","https://www.linkedin.com/company/dan-the-moving-man-wa, https://www.facebook.com/danthepianomanspokane, https://www.instagram.com/danthemovingmanwa, https://www.youtube.com/channel/UCblAD4nV_JGGoFH4pGZnCOg, https://www.yelp.com/biz/dan-the-moving-man-spokane-valley",,Dan The Moving Man,office@danthemovingmanwa.com
Delaney Relocation & Home Support Services Inc.,"Delaney Relocation Services offers moving, downsizing, and home support for seniors in the Comox Valley area of Vancouver Island. They provide personalized services including a free 30-minute consultation to assess clients' needs, information on retirement residences, packing and storage options, and handling all aspects of the move. Their team includes trained packers and movers who ensure everything fits and is set up promptly before moving. Delaney Rel relocation also assists with utilities reconnecting and changing addresses, making it easier for families to manage their living routines effectively.",https://www.facebook.com/pages/delaney-relocation-services/84273726604,"+12503383359, +12507034660",Delaney Relocation & Home Support Services,shauna@delaneyrelocation.com
Déménagement Germain Villeneuve,"Moving.fr is a moving service based in Chicoutimi, Quebec, specializing in residential and commercial moving solutions. They offer a range of services including furniture removal, storage, and transportation for relocations across the region. The company employs trained professionals who ensure safe handling of belongings and provides personalized packing strategies to minimize accidents during moves. Their warehouses are equipped with advanced technology such as CCTV and alarm systems to support secure and efficient operations.",,+14186930605,Déménagement Germain Villeneuve,germainvilleneuve@videotron.ca
Michel Piano,"Michel Piano is a moving company specializing in the transportation of pianos and heavy equipment in Greater Montreal, with nearly 50 years of experience. They offer services for various types of moves, including residential and commercial relocations, as well as specialized transport for items like billiard tables and factory machinery. Key features include safe transport through modern trucks, professional service, and a commitment to customer satisfaction with a free evaluation and ongoing support after the move. The company emphasizes reliability, professionalism, and safety in all its operations.",https://www.facebook.com/demenagementmichelpiano/?modal=admin_todo_tour,+18884174266,Michel Piano,info@demenagementmichelpiano.com
Transportation and Relocation PMG Inc.,"PMG Move is a moving company based in Montreal that offers residential and commercial relocation services. Their main functionalities include packing, transporting, and installing furniture, as well as providing cleaning services before and after the move. PMG also provides full insurance coverage for every move and features transparent pricing with no hidden charges. They serve the Greater Montreal Area and offer specialized services for commercial relocations across Quebec.","https://www.instagram.com/groupepmg, https://www.instagram.com/pmg_canada, https://www.tiktok.com/@demenagementpmg",+15148311764,Transportation and Relocation PMG,info@demenagementpmg.ca
Moving St-Marcel,"Moving St-Marcel is a moving company based in Drummondville, Quebec, specializing in both residential and commercial relocation services. They offer fast and efficient move solutions for short and long-distance moves, ensuring safe transport and compliance with regulations. Key features include 24/7 availability, customized moving plans, competitive pricing, and the ability to handle one-time relocations or larger moves. The company has over 20 years of experience and emphasizes customer satisfaction through professional service and reliable support.",,"+15144613411, +18194754923",Moving St-Marcel,web@anugomedia.ca
Déménagement St-Joseph,"Déménagement St-Joseph is a moving service that specializes in residential and commercial moves in Drummondville, Quebec. They offer packing and transportation services, including the sale and rental of moving equipment such as boxes and bubble paper, ensuring safe handling and careful transport of goods. The company emphasizes customer satisfaction and provides competitive pricing, with over 60 years of experience in the community. Customers can request free quotes for their move needs through the website.",,"+18194781008, +18194784411",Déménagement St-Joseph,demenagementjoseph@gmail.com
Derosier Moving & Storage,"Derosier Moving & Storage offers moving and storage services in Stratford, CT. They provide a range of relocation options including dryer pick-up and delivery, as well as secure storage solutions for items that cannot be stored overnight. The company emphasizes customer satisfaction through personalized service, employs trained drivers and Packers, and has a strong track record with an A+ rating with the Better Business Bureau since 1985. Customers can request free quotes for their moves via phone or email.",https://www.facebook.com/derosier-moving-storage-co-270161073019132,+18008301159,Derosier Moving & Storage,allend@derosiermoving.com
Designer's Moving Service,"Designers Moving Service is a family-owned moving company that offers a range of moving services for both local and long-distance moves in Southern California, as well as nationwide relocations. Their main functionalities include professional packing and unpacking, general labor assistance, and organizing support. They provide transparent pricing with no hidden fees, ensuring a seamless moving experience from start to finish. The team consists of trained movers who prioritize customer satisfaction and reliability, with over 10 years of experience in the industry.","https://www.linkedin.com/company/designer-s-moving-service-inc, https://instagram.com/designersmovingservice","+17146174330, +17146972303",Designer's Moving Service,dms@designersmovingservice.com
Discount Mover Ltd,"The Discount Mover is a moving service based in Prince Edward Island, specializing in both local and long-distance moves across Canada. They offer a range of services including full packing and unpacking for various types of belongings, office relocations, and specialized moving for complex commercial equipment like pianos and hot tubs. The company provides a straightforward three-step moving process that includes expert planning, professional move handling, and complete setup to ensure the safe placement of belongings. They also offer transparent pricing with no hidden costs and have an average rate of $400-500 for local moves, along with comprehensive insurance coverage for all movers.",,"+18443299998, +19028921821",Discount Mover,info@discountmoverltd.com
DIY Mobile Box,"DIY Mobile Box offers portable storage containers designed for both temporary and long-term use. Customers can choose from various container sizes, select a delivery date, and receive assistance with storing items on their property or at the facility. The service includes options for moving within homes, home renovations, disaster recovery situations, and general onsite storage needs such as furniture, toys, and clothing. With over 30 years of experience, DIY Mobile Box emphasizes prompt response to customer inquiries and provides transparent pricing without hidden fees.","https://www.facebook.com/diymobilebox?mibextid=lqqj4d, https://www.instagram.com/diymobilebox?igsh=zjnvz2cyb2nvcjix&utm_source=qr",,DIY Mobile Box,joe@diymobilebox.com
Dry Ridge Moving and Transportation LLC,"Dry Ridge Moving is a moving company based in Asheville, North Carolina, offering local and long-distance moving services for various types of properties including homes, apartments, and commercial spaces. Their main functionality includes packing, transporting, and unpacking belongings efficiently, as well as providing specialized services like senior moves and moving help. Key features include eco-friendly move practices, exclusive truck use for individual moves, and a commitment to customer satisfaction with transparent pricing and no hidden fees.",,+18284503315,Dry Ridge Moving and Transportation,sean@dryridgemoving.com
DunnRite Transitions,"DunnRite Transitions is a moving service specializing in senior move management and downsizing for individuals moving to their homes. The company offers professional packing, organizing, and maintaining the entire relocation process, from planning to final assembly. Key features include customized floor plans, marking and indexing of belongings, and personalized support throughout the moving process to ensure they can stay home. They also provide free estimates and emphasize peace of mind for clients during their moves.",https://www.linkedin.com/company/dunnrite-transitions,+18657173376,DunnRite Transitions,lindadunn@dunnritetransitions.com
Dynamic Xpress Movers,"Dynamic Xpress Movers is a licensed and insured moving company based in Houston, Texas, offering relocation services for both residential and corporate clients. Their main functionalities include local and commercial relocations, expedited moving solutions, professional packing and loading services, and storage options. They focus on providing timely delivery of belongings, ensuring safety and customer satisfaction through thorough background checks and reliable service throughout the relocation process.",,,Dynamic Xpress Movers,info@dynamicxpressmovers.com
Eagle Transfer Company,"Eagle Transfer Company is a moving and storage service based in North Central Washington, offering assistance for residential, commercial, and corporate moves. They provide packing and unpacking services, moving supplies, and self-storage options tailored to individual needs. The company also features moving checklists, video guides, and a selection of furniture relocation products. Additionally, they offer specialized services such as pet storage and shipping solutions.",https://www.facebook.com/eagletransfercompany,"+15096622114, +15096630634",Eagle Transfer,moving@eaglegroup.com
"Earley & Sons Relocation, LLC","Earley & Sons Relocation is a moving company that provides services for families and individuals in the Greater Youngstown area, including boardsmen, Canfield, Austintown, and Niles. They offer packing, unpacking, cleaning, and organizing services tailored to various moving needs such as family relocations, senior relocation, business relocation, and home downsizing. The team consists of experienced professionals who focus on making the moving process stress-free and efficient while ensuring safety and comfort during transitions.",,,Earley & Sons Relocation,info@earleyandsons.com
Econo Moving & Storage Ltd.,"Econo Moving & Storage Ltd. is a moving and storage company based in North Vancouver, specializing in various relocation services. They offer packing, storage solutions, and mini storage options, including temperature-controlled boxes and POD containers. The company provides free estimates, expert movers, and supplies to help clients manage their moving needs efficiently. Econo aims to create a stress-free experience for families while ensuring quality service at competitive rates.","https://www.linkedin.com/company/econo-moving-&-storage-ltd, https://www.facebook.com/economoving",+16049803333,Econo Moving & Storage,info@economovingandstorage.ca
Superior Economy Moving,"Superior Economy Moving is a moving company based in Los Angeles, California, specializing in both local and long-distance moves. They offer a range of services including packing, storage, furniture delivery, and garage sale assistance for individuals and businesses with large amounts of belongings. Key features include flat-rate quotes, hourly rates for packing services, free wardrobe services, and a commitment to simplifying the move process through helpful resources such as moving guides and helpful information.",,"+13106960188, +18003240334, +18052238183, +18185479904, +18188846125",Superior Economy Moving,economy@roadrunner.com
ECS Solutions,"ECS Solutions is a company that provides office furniture installation and moving services. Their main functionality includes optimizing workspaces through design, decommissioning of existing furniture, and providing IT relocation support. Key features include tailored project planning, safety compliance, and ongoing maintenance, ensuring smooth transitions for corporate offices, healthcare facilities, and educational spaces. They also offer specialized services like office furniture rental and donation.","https://www.facebook.com/ecssolutionsinc.on, https://www.instagram.com/ecs.solutions.inc",+16477093997,ECS Solutions,info@ecssolutions.ca
Elite Furniture Moving,"Elite Furniture Moving is a full-service moving company based in San Diego, California, offering a range of relocation services for both local and long-distance moves. Their main functionality includes providing professional moving solutions such as packing, storage, and transportation, ensuring a smooth relocation process from start to finish. Key features include an on-time guarantee, customer communication throughout the move, and a commitment to quality service with transparent pricing and no hidden fees. They also offer specialized services like custom furniture moving and storage solutions.","https://www.linkedin.com/company/elite-furniture-moving, https://www.facebook.com/elitefurnituremoving, https://twitter.com/elitefurniturem",+16196391464,Elite Furniture Moving,info@elitefurnituremoving.com
Elite Movers,"Elite Movers is a moving company based in Wisconsin that offers local and long-distance moving services. They provide trained professionals for various moves, including corporate relocation, senior moving, and climate-controlled storage. Key features include a price match guarantee, a customer portal for information on moving responsibilities and pricing, and specialized services like white-glove handling of fragile items. Elite Movers also emphasizes transparent pricing and has received positive reviews from clients for their service and support throughout the move process.","https://www.linkedin.com/company/elite-movers, https://www.facebook.com/elitemovers, https://twitter.com/elitemovers",+17152012229,Elite Movers,scheduling@elitemovers.com
