Name,Description,Social URLs,Phones,company_clean,Final Email
Relocate Tampa Bay,"Relocate Tampa Bay is a relocation service that assists individuals, families, and employees moving to the Tampa Bay area. The company offers tailored solutions for new residents, including assistance with finding suitable schools, childcare facilities, and spousal support services. They also provide orientation tours and collaborate with local vendors to ensure a seamless relocation process. Their goal is to help clients settle in and integrate into their communities effectively.","https://www.linkedin.com/company/relocate-tampa-bay-llc, https://www.facebook.com/relocate-tampa-bay-105034637544942, https://www.facebook.com/relocate-tampa-bay-105034637544942/?modal=admin_todo_tour, https://www.instagram.com/relocatetampabay",+18559390813,Relocate Tampa Bay,info@relocatetampabayfl.com
Relocation Remedies,"Relocation Remedies offers services to simplify employee relocation and reduce costs. Their main functionalities include a Discard & Donate service that helps employees declutter and remove items prior to their shipment, as well as a Premium Unpacking service that assists with the packing process to help employees transition into their new homes. The company aims to create a stress-free moving experience while promoting environmental sustainability.",https://www.linkedin.com/company/relocation-remedies,+14123662760,Relocation Remedies,info@relocationremedies.com
Relocation Solutions Inc.,"Relocation Solutions Inc. is a full-service moving company based in the Washington DC area and across the continental United States, specializing in commercial, government, and residential relocations. They offer a range of services including packing, storage, furniture transport, and labor support for relocation needs. The company provides free estimates, specialized moving solutions for military personnel and seniors, and has over 25 years of experience in the industry, ensuring professional service and tailored solutions for clients' relocation requirements.",https://x.com/relocasolutions,+18449916683,Relocation Solutions,info@relocationsolutionsinc.com
Repax,"Repax is a moving service provider based in Los Angeles that offers a variety of relocation solutions for both residential and corporate moves. Their main functionalities include local, corporate, and group relocations, as well as specialized packing and unpacking services. Key features include free quotes, competitive pricing with no hidden fees, and tailored moving strategies to ensure smooth transitions for clients across various industries. Repax also provides transportation options such as caravans and furniture, along with storage solutions like wardrobe boxes and moving blankets.",https://www.yelp.com/biz/repax-movers-orange,+13238184448,Repax,book@repax.biz
Rise Up Moving,"Rise Up Moving is a full-service moving company operating in Texas and the Bay Area, specializing in residential and commercial moves. They offer a range of services including long-distance move arrangements, packing, and specialized moves for art, furniture, and home decor. The company emphasizes white glove service, personalized customer support, and transparent pricing with no hidden fees or charges. Rise Up Moving also provides free packing services and has experience working with various relocation needs across California and Texas.",,+14699725915,Rise Up Moving,info@riseupmoving.com
RMR,"RMR is a managed moving service that provides tailored relocation solutions for individuals and corporations. It offers services such as self-moveings, corporate moves, hospital moves, office relocations, and real estate management. Key features include dedicated customer service agents, move audits to ensure compliance with contracts, and a client dashboard for tracking move information and reporting. RMR aims to simplify the moving process while saving clients money on their moving costs.",https://www.linkedin.com/company/relocation-management-resources-inc.-rmr-,"+12038382060, +18002284515, +17753242888, +18008268207",RMR,operations@rmronline.com
Roanoke Moving,"Roanoke Moving is a moving company based in Roanoke, Virginia, offering a variety of relocation services for both local and long-distance moves. Their main functionalities include move planning, packing, logistics, and storage solutions tailored to meet the needs of residential, commercial, and industrial relocations. Key features include free quotes, professional movers, specialized services for families and businesses, and a commitment to quality service with a focus on customer satisfaction. The company has over 20 years of experience and operates under a bonded and insured environment.","https://www.linkedin.com/company/roanoke-moving, https://www.facebook.com/roanoke-moving-185576918810516, https://twitter.com/movingroanoke",+15406804700,Roanoke Moving,info@roanokemoving.com
Rocket City Movers of Huntsville,"Rocket City Movers of Huntsville is a moving company that offers residential and commercial moving services in the Huntsville area. They provide same-day service estimates and emphasize quick response times, typically within 48 hours. The company also offers virtual consultations and competitively priced moving rates, along with a referral program for customers who wish to support their move needs.","https://www.linkedin.com/company/82309736, https://www.linkedin.com/company/rocketcitymovershuntsville, https://facebook.com/rocketcitymoversofhuntsville, https://instagram.com/rocketcitymoversofhuntsville",+12563376888,Rocket City Movers of Huntsville,movers@rocketcitymoversofhuntsville.com
Rose City Professional Organizing,"Rose City Professional Organizing offers home decluttering and organization services in Calgary and Edmonton. Their main functionality includes assessing belongings, designing spaces for better organization, and providing coaching to help clients find the right items for their needs. Key features include personalized organizing systems, donation collection, and a free home assessment to identify areas for improvement. The team focuses on creating a stress-free environment while improving clarity and enjoyment in homes.",https://www.instagram.com/rosecityorganizing,,Rose City Professional Organizing,christa@rosecityprofessionalorganizing.com
RR Move Co.,"RR Move Co. is a move management company based in Seattle that specializes in assisting older adults and their families with relocation and the emotional aspects of moving. The service offers customized move plans, schedules, budgets, and support tailored to each client's needs, ensuring smooth transition into new homes. Key features include a focus on creating momentum for the moving process, personalized assistance throughout the moving experience, and a commitment to helping clients navigate the logistics and emotions involved in their moves.",https://www.instagram.com/rr.move.co,+12064466588,RR Move,movemagician@rrmoveco.com
RVA Movers,"RVA Movers is a moving company based in Richmond, VA, that offers labor-only moving services for residential moves, senior transitions, and local logistics. Their main functionality includes packing, unpacking, and heavy lifting assistance tailored to various move types such as homes, condos, and townhomes. Key features include a streamlined quote process, transparent pricing with no hidden fees, and specialized support for items like pianos and oversized furniture. RVA Mo Moving also provides free estimates and has over 1,500 moves completed, ensuring customer satisfaction throughout the moving process.",https://x.com/replit,+18048018079,RVA Movers,quote@rvamovers.com
Santa Rosa Moving & Storage,"Santa Rosa Moving & Storage is a moving company that provides residential and commercial moving services in the Bay Area, including San Francisco, Marin, and Sonoma County. They offer professional-grade packing supplies, specialized boxes for fragile items, and fully monitored storage solutions. The company emphasizes health safety and customer satisfaction, ensuring that all aspects of the move are handled efficiently and effectively. Customers can request free estimates and receive tips on packing to prepare for their move on moving day.",,"+14153328585, +17075848585",Santa Rosa Moving & Storage,jay@santarosamoving.com
SCV Moving Company,"Santa Clarita Moving Company is a local moving service based in Santa Clarita, California, specializing in residential and commercial moves for both residents and businesses. They offer a range of services including packing, storage, assembly, and transportation, with no hidden fees or delays during the move. The company operates its own moving trucks and provides free packing supplies, ensuring a hassle-free experience with trained movers who prioritize safety and efficiency. Additionally, they offer express long-distance moving within California and provide assistance with customs clearance and insurance needs.","https://www.facebook.com/scv-moving-company-movers-of-santa-clarita-106108157426900, https://www.instagram.com/scvmoving, https://www.yelp.com/biz/scv-moving-santa-clarita-santa-clarita-2?osq=movers, https://yelp.com/biz/greater-los-angeles-movers-los-angeles-4?utm_medium=badge_star_rating_reviews&utm_source=biz_review_badge",+16619981212,SCV Moving,info@scvmoving.com
Sea To Sky Moving & Delivery,"Sea To Sky Moving is a moving company that offers express moves and delivery services between Vancouver, Squamish, and Whistler. They provide free quotes for residential and commercial moves, including small items like furniture and art, as well as weekly shuttles to facilitate timely travel. Their fleet includes 16' cube vans suitable for various sizes, and they offer additional services such as heavy-duty moving blankets and tape on move days. The company emphasizes customer satisfaction with a Happiness Guarantee and has multiple locations across Canada.",,+17786561502,Sea To Sky Moving & Delivery,hello@brightfuturebrands.com
SEBA TRANSPORT,"SEBA TRANSPORT offers a range of removal services for individuals and businesses looking to facilitate quick and easy relocation. Their main functionalities include piano relocation, object collection, small moves, and assembly and installation. Customers can request free quotes by contacting the company directly, and they provide detailed information about their services on their website.","https://www.facebook.com/sebatransport5147038080, https://www.instagram.com/sebatransport",+15147038080,SEBA TRANSPORT,info@sebatransport.com
Setup NYC,"setup NYC is a handyman and warehousing service company based in New York City and NJ. They offer a wide range of services including residential and commercial home repairs, furniture assembly, electrical installations, plumbing, and logistics support. Key features include 24/7 customer service, affordable pricing with no hidden fees, and a team of experienced contractors who are vetted for safety and professionalism. The company also provides specialized services such as vinyl graphics installation, office remodeling, and custom warehouse solutions.","https://www.linkedin.com/company/set-up-nyc, https://www.instagram.com/setupnyc, https://www.yelp.com/biz/set-up-nyc-brooklyn?osq=set+up+nyc",+12127397826,Setup NYC,info@setupnyc.com
SFV Moving Company,"San Fernando Valley Moving Company is a licensed and insured moving service that provides residential and commercial relocation assistance across the San Fernando Valley and Los Angeles County. They offer a range of services including packing, storage, shipping, and express long-distance moving within California with no waiting time for items. The company emphasizes safety, professionalism, and transparent pricing without hidden fees, ensuring a hassle-free moving experience. Their professional packers are trained to handle various moving tasks, including furniture assembly and disassemble, while providing all necessary packing supplies and equipment for efficient relocations.","https://www.facebook.com/sfvmoving, https://www.yelp.com/biz/scv-moving-santa-clarita-santa-clarita-2?osq=movers, https://yelp.com/biz/greater-los-angeles-movers-los-angeles-4?utm_medium=badge_star_rating_reviews&utm_source=biz_review_badge",,SFV Moving,info@sfvmoving.com
Movers and Shakers,"Movers and Shakers is a bar catering service based in New Orleans, Louisiana, specializing in hiring professional bartenders for weddings and corporate events. They offer a range of services including custom drink menus, cocktail setup, and event management support tailored to the size of each party. The company has been operating since 2015 and employs experienced staff who are fully insured and dedicated to delivering high-quality service.","https://www.linkedin.com/company/movers-shakers-nola, https://www.facebook.com/moversandshakersnola, https://instagram.com/moversandshakersnola",+15044754155,Movers and Shakers,hello@shakersnola.com
Shalom Movers  Moving & Storage,"Summit Heights is a public school in Toronto that focuses on providing an inclusive and supportive learning environment for students. The school emphasizes the development of knowledge, skills, and values essential for success in a global society. It offers various programs, including special education, arts, and community engagement initiatives, aimed at fostering personal growth and social responsibility among its students. Additionally, Summit Heights provides resources such as a virtual library and contact information for inquiries.","https://www.facebook.com/shalom-movers-176436042414600, https://x.com/shalommovers",+17807086000,Shalom Movers  Moving & Storage,info@shalommovers.ca
Shaw Moving & Storage Inc,"Shaw Moving & Storage Inc is a moving and storage company based in Crestview, Florida, serving the local community since 1956. They offer a range of services including long-distance moves, residential and commercial relocation, packing, unpacking, and storage solutions for items like furniture and medical equipment. The company emphasizes safety, professionalism, and personalized customer service throughout the moving process, ensuring that belongings are safe and organized. Additionally, they provide free estimates, flexible pricing options, and have a fleet of well-equipped vehicles suitable for various moving needs.",,"+18506822765, +18506891333, +18886677186",Shaw Moving & Storage,craigshaw99@hotmail.com
Sweet Home Movers Chicago Inc,"Sweet Home Movers is a moving company based in Chicago that offers a variety of moving services for both residential and commercial clients. Their main functionalities include standard moving, local, long-distance, and specialized moves such as furniture rearrangement and storage solutions. The team consists of fully insured movers who prioritize customer service and provide personalized assistance throughout the moving process, ensuring a smooth experience with timely showroom arrivals and professional packing and unpacking. They also offer free quotes and have multiple service areas across the city, catering to various types of relocations including Cook County and surrounding areas.","https://www.linkedin.com/company/sweet-home-movers-chicago-inc, https://www.facebook.com/shmchicago, https://www.instagram.com/sweet_home_movers_chicago, https://www.yelp.com/biz/sweet-home-movers-chicago-chicago","+17738953644, +13122195388, +13128241193",Sweet Home Movers Chicago,info@shmchicago.com
Silver Pathways,"Silver Pathways Consulting offers professional services for downsizing, moving, listing, and settling in for families in Henderson County and southern Buncombe County. Their main functionality includes planning, organizing, packing, and managing the entire process of selling homes or moving properties. Key features include personalized support throughout the move, clear communication, and a focus on maximizing property value through thoughtful donation and donating. The team aims to simplify the downsizing experience for clients at any stage of their journey.",https://www.linkedin.com/company/silverpathwayshome,"+18285854343, +18285954343",Silver Pathways,hello@silverpathwayshome.com
Simple Moving,"Simple Moving Company offers moving services for both residential and commercial clients in Los Angeles. Their main functionality includes providing professional moving assistance, packing, storage, and unpacking of items over 300 pounds. They are fully licensed and insured, offer flat rates with no hidden fees, and provide free home visual estimates to ensure a smooth move. The company serves various areas including Anaheim, Bel Air, Beverly Hills, and Costa Mesa, catering to different types of moves such as family estates, small offices, and long-distance relocations.","https://www.facebook.com/simplemoving.us, https://www.instagram.com/simplemoving.us, https://www.yelp.com/biz/e5xlsood2znvtjanbj10da, https://www.yelp.com/biz/simple-moving-company-culver-city-2?hrid=ejnyfg56hu689izuhxkyiw, https://www.yelp.com/biz/simple-moving-company-culver-city-2?hrid=v5hznwj1gyyx4ugq7mb6tq, https://www.yelp.com/biz/simple-moving-company-culver-city-2?hrid=wgdlmrhldsufr5qmwuvscq, https://www.yelp.com/biz/simple-moving-company-culver-city-2?hrid=wo966auoe3sqmp-2cspysq, https://www.yelp.com/biz/simple-moving-company-los-angeles-2",+18885884118,Simple Moving,office@simplemoving.us
Simplify Experts,"Simplify Experts is a professional organizing service based in the Greater Seattle Area and Eastside. They specialize in home decluttering, ADHD organizing for neurodivergent clients, and supporting moving, remodeling, and paperwork organization. Their team of trained professionals offers personalized consultations to help clients improve their home management and achieve better living spaces. Key features include digital organizing solutions, packing assistance, and tailored strategies to meet individual needs.","https://www.linkedin.com/company/simplify-experts, https://www.facebook.com/simplifyexperts, https://www.instagram.com/simplifyexperts, https://twitter.com/simplifyexperts, https://www.pinterest.com/simplifyexperts",+14257705759,Simplify Experts,info@simplifyexperts.com
"Skyline Movers, Inc.","Skyline Movers is a moving and storage company based in University Park, Illinois, affiliated with United Van Lines. They offer services for local, long-distance, and international relocations, including home, office, furniture, and equipment moves. Key features include specialized packing solutions, safe transportation of goods, and a commitment to quality labor training for drivers and packers to ensure effective movement and security. Skyline Mo Moving also provides secure storage options and has a warehouse located near Chicago.",https://www.linkedin.com/company/skyline-movers-inc,"+17085349111, +17085349124, +18009423171",Skyline Movers,info@skylinemovers.com
Sky Van Line Moving Company,"Sky Van Line Moving Company offers long-distance moving, packing, and storage services for both personal and commercial moves across the 48 states in the USA. They operate their own fleet of trucks and trailers, providing a range of transportation options including small trucks and shuttle trucks. The company emphasizes personalized service, no middlemen or outside carriers, and offers a 30-day free storage option when customers complete their move. Additionally, they provide packing services with insurance coverage to ensure smooth relocation.",,+18006671318,Sky Van Line Moving,info@skyvanline.com
Slick Moving & Storage,"Slick Moving is a moving company based in New York City that offers a range of relocation services for both residential and commercial clients. Their main functionalities include house moving, office moving, furniture moving, packing and unpacking, and secure storage solutions. Key features include a fleet of trucks designed for various move types, personalized customer service, and a commitment to reliable and stress-free moving experiences. They also provide climate-controlled storage options tailored to different needs.","https://www.linkedin.com/company/slick-moving-brooklyn, https://www.facebook.com/people/slick-moving-brooklyn, https://www.facebook.com/people/slick-moving-brooklyn/61550582725742, https://www.instagram.com/slickmoving, https://twitter.com/slickmoving, https://www.youtube.com/channel/UChhBooTxLQjZLdGWJdwTxTA, https://www.yelp.com/biz/slick-moving-brooklyn-new-york","+19293912292, +18884932503",Slick Moving & Storage,sales@diamondhandsmoving.com
SNOWGO,"SNOWGO is a snow and ice management company that provides winter services to airports, commercial properties, and government entities. Their main offerings include deicing, snow removal, and snow melt, utilizing a large fleet of trucks and equipment for effective service. SNOWGO also specializes in emergency response and has a dedicated team that collaborates with clients to develop tailored management plans before and during severe weather. They operate 24/7 across multiple states and offer specialized services like anti-ice solutions and snow remediation.","https://instagram.com/snowgous, https://twitter.com/snowgous",+18002859668,SNOWGO,info@snowgo.us
Solidarity Movers,"Solidarity Movers is a moving company based in New York City that offers a range of services including packing, same-building moves, commercial real estate move, and storage. They provide both local and interstate movers, ensuring flexibility for clients with flexible moving dates and a flat rate pricing model. The company emphasizes customer service, has over 25 years of experience, and features a team of experienced movers who prioritize safety and professionalism throughout the moving process. Customers can request quotes through an online form or by text, and the company also offers free shipping on orders over $100 within the NYC area.","https://www.linkedin.com/company/solidarity-movers, https://www.instagram.com/bedstuywalls, https://www.instagram.com/bigreuse","+16465986683, +19292954228",Solidarity Movers,hello@solidaritymovers.com
Sorted by Snow,"Sorted by Snow is a professional home organizing service that specializes in decluttering, organizing, and moving preparation for homes and businesses across the country. The main functionality includes in-person decluttering and creating customized organizational systems tailored to individual needs, as well as managing moving logistics and donating items. Key features include monthly organizing subscriptions for ongoing support, donation drop offs, and a focus on reducing clutter and improving space organization through expert guidance and practical solutions.","https://www.facebook.com/sortedbysnow/?modal=admin_todo_tour, https://www.instagram.com/sortedbysnow, https://www.pinterest.com/zsnow3897",,Sorted by Snow,zoe@sortedbysnow.com
SOMD Movers,"SOMD Movers is a moving company based in Southern Maryland that offers a variety of moving services for residential, commercial, and long-distance moves. Their main functionalities include packing, unpacking, and storage solutions, with options for last-minute moves and specialized services like furniture moving and senior mobility. Customers can request free estimates, schedule move scheduling, and receive assistance throughout the relocation process, ensuring a smooth and stress-free experience. The company is fully insured, has over 20 years of experience, and provides 24/7 customer support.",https://www.yelp.com/biz/somd-movers-white-plains,+18887114778,SOMD Movers,info@southernmarylandmovers.com
SpaceMaker Mobile Storage,"SpaceMaker Mobile Storage offers portable storage solutions for both residential and commercial clients in the DC, VA, and Maryland areas. The service provides secure storage containers that can be delivered directly to customers' homes or on-site, allowing them to store their belongings at their convenience. Key features include free initial delivery, discounts for over 12 months on long-term rentals, and a variety of sizes and types of storage options tailored to different needs. SpaceMaker also emphasizes customer satisfaction with reliable service and quick turnaround times for moving and storage services.","https://www.facebook.com/spacemakermobile, https://www.instagram.com/spacemakerdmv",+18339977223,SpaceMaker Mobile Storage,hello@spacemakermobile.com
Splendid Furniture Rentals,"Splendid Furniture Rentals is a furniture rental service that offers both short-term and long-term options for residential and commercial spaces. They provide a wide selection of 100% new furniture, including dining tables, chairs, and bedroom sets, tailored to meet various client needs such as relocation, corporate events, and temporary housing during emergencies. Key features include fast delivery, expert customer support, and the ability to customize rental packages based on individual lifestyles and budgets.",,+17807840638,Splendid Furniture Rentals,info@splendidfurniturerent.ca
Springfield Van and Storage Co.,"Springfield Van and Storage Co. offers moving services for both residential and commercial clients in Springfield, Illinois. They provide a range of solutions including local, long-distance, employee relocation, international, military, and government moves. Additionally, they offer storage options ranging from short-term to long-term storage and in-transit storage. The company has over 60 years of experience in the industry and aims to simplify the moving process for customers by handling all aspects of their move needs.",https://www.facebook.com/springfield-van-and-storage-co-bekins-van-lines-1701351583461106/?fref=ts,"+12177862000, +12177862550, +18006372956",Springfield Van and Storage,dmb@springfieldvan.com
