Name,Description,Social URLs,Phones,company_clean,Final Email
2 Brothers Services Inc,"2 Brothers Services Inc is a flat-rate moving company based in Covington, GA, specializing in the relocation of homes and businesses. They offer unlimited moving hours and provide transparent pricing without hidden fees. Their services include packing, unpacking, furniture delivery, air purification, and custom moving solutions for various needs such as home renovations and appliances. The company emphasizes customer service and aims to create a stress-free moving experience while ensuring quality care for clients' properties.",,"+16785236133, +16788292767",2 Brothers Services,info@2bservicesatl.net
2 Guys 4 Hire,"2 Guys 4 Hire is a moving company that provides professional moving services in Colorado Springs, Denver, and Dallas/Fort Worth. They offer a range of moving assistance for both residential and commercial moves, including long-distance moves, furniture assembly, and packing. The service includes instant quotes, transparent pricing with no hidden fees, and a commitment to customer satisfaction, backed by over 30 years of experience and multiple relocation certifications. Their team consists of local professionals who assist clients throughout the move process, ensuring personalized support and efficient management of their belongings.",,"+17199306349, +17205934897, +18173821322",2 Guys 4 Hire,russ@2guys4hire.com
All My Sons Moving & Storage,"2MOVERS is a local and nationwide moving service that connects customers with professional movers for various moves, including residential, commercial, and long-distance transfers. The company offers personalized moving assistance through trained professionals who handle all aspects of the move, including packing, storage, and repairs. With over 25 years of experience, 2MOVers operates more than 60 locations across the United States, providing tailored solutions to meet individual customer needs while ensuring a smooth moving process.",,"+18557970382, +18886650881, +18443012720, +18772745928, +18777737350, +18778041448, +18778844738, +18888888888, +18889070428",All My Sons Moving & Storage,info@2movers.com
305 Movers,"305 Movers is a moving company based in Miami that offers residential, commercial, and specialty moves for both residents and local businesses. Their services include packing, transportation, furniture disassembly, and all-inclusive moving solutions with no hidden fees or additional costs. They operate throughout the Miami area, including major cities like Coral Gables and Miami Beach, and provide free estimates and quotes through an online booking system. Key features include a fleet of 26-foot trucks for efficient transport, a commitment to customer satisfaction, and a focus on providing personalized service throughout the move process.",,,305 Movers,info@305movers.com
A-1 Moving Co.,"A-1 Moving Co. is a professional moving company based in St. Catharines, Ontario, specializing in residential and commercial moves, as well as specialized services for senior citizens and small items. They offer a range of moving solutions including packing, unpacking, delivery, and overnight trailer storage, ensuring safe and efficient relocation processes. The team consists of fully insured and non-smokers who prioritize safety and customer satisfaction throughout the moving process. A-1moving Co. also provides flexible pricing options, including hourly rates and off-peak service packages, to accommodate various moving needs.",,+19056843995,A-1 Moving,movinggenerations@cogeco.ca
A2 Moving Company,"Avery Smith A2 Moving is a professional moving company based in Los Angeles and Orange County, specializing in long-distance moves. They offer a range of services including packing, storage, and legal assistance for individuals and businesses. The company emphasizes customer satisfaction, competitive pricing, and specialized labor solutions, ensuring a smooth move experience with their experienced team. Their operating hours are Monday to Friday from 8 AM to 8 PM and Saturday from 8 PM to 8 pm.",https://www.yelp.com/biz/a2-moving-los-angeles,+15627595069,A2 Moving,info@a2movingcompany.com
Abba Movers LLC,"Abba Labor Solutions is a moving company based in New Orleans and Baton Rouge that offers a range of services for long-distance moves. Their main functionalities include packing, loading, unloading, and furniture placement, as well as full and partial packing options tailored to individual needs. They provide professional coordination for move logistics, ensuring smooth and organized processes throughout the moving process, with no deposit required. The company emphasizes customer satisfaction and aims to deliver reliable support for both residential and commercial relocations.","https://www.facebook.com/abbamovers, https://www.yelp.com/biz/abba-movers-baton-rouge-4, https://www.yelp.com/biz/abba-movers-new-orleans-3","+12252524407, +12253846683, +15044504959",Abba Movers,info@abbamovers.com
ABC Movers,"ABC Movers is a moving company that offers a range of services for both local and long-distance moves. Their main functionalities include packing, crating, furniture assembly, and climate-controlled storage. They utilize barcoded inventory scans to ensure proper oversight during the move, and they provide same-week scheduling for commercial moves across multiple states. The company emphasizes customer satisfaction with a strong chain of custody and has over a decade of experience in the industry.","https://www.linkedin.com/company/abc-movers, https://www.facebook.com/abcmovers, https://www.instagram.com/abcmovers, https://twitter.com/abcmovers, https://www.yelp.com/biz/abc-movers-los-angeles",,ABC Movers,info@abcmovers.com
ABC Moving & Storage,"The website offers moving and storage services in Greenville, NC, specializing in the safe destruction of sensitive materials. It provides a range of solutions including free packing, transportation, storage, and legal assistance for individuals and businesses looking to relocate or store their belongings. The company emphasizes quality service with advanced technology and has been serving the community since 1949, ensuring comprehensive support throughout the moving process.",,+12527524500,ABC Moving & Storage,abc@abcmovingnc.com
Best Moving Service,"Best Moving Services is a family-owned moving company based in Anaheim, California, specializing in residential and commercial relocations. They offer a range of services including packing, transportation, heavy lifting, storage, and specialized move solutions for luxury apartments with challenging layouts. With over 35 years of experience, the company emphasizes customer satisfaction and provides transparent pricing without hidden fees, ensuring that clients receive support throughout their moving process.","https://www.linkedin.com/company/best-moving-service, https://www.yelp.com/biz/best-moving-service-anaheim-3","+16575306177, +17143851700",Best Moving Service,best@abestmoving.com
ABS Moving and Storage Inc.,"ABS Moving and Storage is an independent moving company that provides local and long-distance moving services across the continental United States, including Washington DC, Maryland, Virginia, Ohio, and Colorado. Their offerings include packing, unpacking, local pickups, transport, and delivery, ensuring personalized customer service throughout the move process. With over two decades of experience, ABS Movers focuses on delivering cost-effective moving solutions tailored to individual needs while maintaining a commitment to personal attention from staff.",https://www.yelp.com/biz/abs-moving-and-storage-silver-spring-2,,ABS Moving and Storage,info@absmoving.com
A Couple Great Movers,"Nationwide Moving of America offers professional packing and relocation services in Fort Lauderdale for both residential and commercial clients. Their services include local moving, long-distance relocations, specialized moves for offices and apartments, and comprehensive moving solutions such as fragile items and furniture disassembly. They provide transparent pricing with no hidden fees, a minimum move time of two hours, and a commitment to safe handling of sensitive belongings. The company emphasizes customer satisfaction and has over 30 years of experience in the moving industry.",,,A Couple Great Movers,info@acouplegreatmovers.com
Adler Moving Systems,"Adler Moving Systems is a family-owned moving company based in Sault Ste. Marie, Ontario, specializing in local, international, and residential moves for families and businesses. They offer a range of services including commercial contract moving, cartage, deliveries, and industrial hauling. The company is affiliated with Atlas Canada, ensuring quality service and personalized support throughout the relocation process. Adler Moving systems emphasizes efficient and affordable solutions tailored to individual client needs.",,"+17057591661, +18003530374",Adler Moving Systems,adlermoving@bellnet.ca
A & D Movers,"A & D Movers is a moving company based in Toronto that offers residential and business moving services across Ontario. With over 43 years of experience, they provide customized moving solutions for both home and business moves, including full and partial packing options. Their trained professionals arrive at clients' homes with necessary supplies for safe moving and storage, ensuring a smooth moving experience without hidden fees or late checkout times. A&D Movers also emphasizes transparent pricing and customer service, with a focus on timely and friendly assistance throughout the move process.","https://www.facebook.com/admover, https://www.instagram.com/theboxguys/?hl=en, https://twitter.com/ad_movers",+14166902100,A & D Movers,anton@admovers.ca
Affordable Moving & Storage,"Impressum is a data management and visualization service that specializes in high-volume data processing, machine learning, and software development. The company offers customized solutions for various industries, including semiconductor production and transportation systems. Key features include data mining, visualization, and universal messaging services, along with support for digital transformation projects and advanced data analysis. Impressum also provides user experience options for tracking cookies and managing data privacy practices.","https://www.linkedin.com/company/affordable-moving-&-storage-inc, https://www.facebook.com/www.affordablemovingstorage.net, https://twitter.com/mydenvermovers",+13036937077,Affordable Moving & Storage,sales@affordablemoving.net
Affordable Moving Utah,"Affordable Moving Utah is a moving company based in Salt Lake City that offers both local and interstate relocation services. Their main functionalities include local moving, interstate moving, storage solutions, packing services, and commercial delivery. They provide 24/7 customer support, handle heavy items safely, and offer specialized services for home improvement projects. The company emphasizes efficient service with trained movers and competitive pricing to ensure a smooth relocation experience for clients.",,+18014202334,Affordable Moving Utah,hyrum.rosquist@kw.com
Alberta First Choice Moving,"Alberta First Choice Moving is a moving company based in Edmonton, specializing in residential and office relocations across Alberta. They offer a range of services including packing, furniture assembly, and senior relocation assistance. The company provides free estimates, on-time arrival guarantees, and a Worry-Free Move Guarantee to ensure smooth moving experiences. With over 40 years of experience, their team focuses on customer satisfaction and offers transparent pricing with no hidden fees.",,"+17804406676, +18006765212",Alberta First Choice Moving,info@albertafirstmoving.ca
A-Line Relocation,"A-Line Relocation is a packing, moving, and storage company based in Austin, Texas. They offer a range of services including local and long-distance moves, precision packing, unpacking, staging, and vehicle transportation for various types of belongings such as furniture and art. A-Line specializes in senior relocation assistance, providing tailored solutions to meet the specific needs of seniors, ensuring that all items are handled with care and protection. Their team consists of experienced movers who prioritize customer satisfaction and provide free estimates for move-related tasks.",,,A-Line Relocation,travis@alinerelocation.com
All Brunswick Van Lines,"All Brunswick Van Lines is a moving company that offers residential and international relocation services. They provide transportation, storage, and repair for various types of belongings, including furniture, clothing, and home appliances. The company emphasizes customer satisfaction and quality service, offering free in-home surveys to help clients determine their moving costs. Additionally, they assist with customs clearance and offer specialized moves like the International Movable categorized by category.","https://www.linkedin.com/company/all-brunswick-van-lines-inc, https://www.facebook.com/allbrunswick, https://www.facebook.com/allbrunswick/?ref=bookmarks, https://twitter.com/allbrunswick, https://x.com/allbrunwick","+17322741682, +17322741881, +18004434750",All Brunswick Van Lines,sales@allbrunswick.com
All City Durham,"All City Durham is a family-owned business that provides moving, storage, and demolition services in the Durham region. They offer mobile storage containers ranging from 14 to 50 feet, as well as short or long-term storage solutions. Their services include garbage disposal bins for both residential and commercial use, household furniture staging, and specialized demolition services for machinery needs. The company emphasizes customer satisfaction and aims to provide reliable service with competitive pricing.",,,All City Durham,info@allcitydurham.com
All Directions Van Lines,"All Directions Van Lines is a moving company that offers a range of services for residential and long-distance moves across the United States. Their main functionalities include local, state-to-state, cross-country relocations, customized packing plans, and secure storage solutions. They provide free estimates, transparent pricing with no hidden fees, and utilize modern equipment to ensure safe relocation practices. The company emphasizes customer satisfaction through professional service, reliable support, and a commitment to safety during the move process.",,,All Directions Van Lines,quote@bestusmovinginc.com
Alliance Van Lines,"Alliance Van Lines is a moving company that offers a range of relocation services for individuals and businesses across North America. Their main functionalities include organizing cross-country moves, local and corporate relocations, storage options, and custom crating services. Key features include basic packing services, vehicle shipping, moving costs determination, and the ability to track shipments online. The team consists of trained relocation specialists who provide personalized support throughout the moving process.",,+18775339491,Alliance Van Lines,info@alliancevanlines.ca
"Allied Van Lines, Inc.","Allied Van Lines is a moving company in Canada that offers a range of relocation services for individuals, corporations, and corporate relocations. Their main functionality includes providing household moving, long-distance moves, and international moving solutions tailored to various needs such as furniture assembly, storage, and transportation. Key features include transparent pricing with no hidden fees, 24/7 customer support, and a commitment to professional movers who are trained and insured. They also offer resources like packing tips and moving guides to help clients manage their moving logistics effectively.","https://www.linkedin.com/company/allied-van-lines, https://www.linkedin.com/company/sirva-canada, https://www.facebook.com/alliedvanlines, https://x.com/alliedvl","+13126166560, +13128190404, +16305703009, +18004702851, +18006689346, +18335910364, +18777047470, +18777256286, +61288682819, +18004446787",Allied Van Lines,intlclaims@sirva.com
All Seasons Movers & Storage,"All Seasons Movers & Storage is a family-owned moving company based in Sugar Land, TX, offering a range of relocation services since 1986. Their main functionalities include local and long-distance moving, piano moves, office relocations, packing and unpacking, and storage solutions. The company specializes in personalized moving experiences tailored to the specific needs of residents in Sugarland, ensuring respect for belongings and community requirements. They also provide transparent pricing with no surprise fees and fully licensed and insured movers who prioritize customer satisfaction.","https://www.linkedin.com/company/all-season-moving-&-storage, https://www.facebook.com/allseasonsmove, https://www.facebook.com/allseasonsmove/about?_rdc=1&_rdr, https://www.facebook.com/allseasonsmove/reviews, https://www.instagram.com/allseasonsmoverstx, https://www.pinterest.com/allseasonsmovingstorage, https://www.yelp.com/biz/all-seasons-movers-and-storage-sugar-land-2, https://www.yelp.com/biz/all-seasons-moving-and-storage-sugar-land-4","+12819037688, +12813463418",All Seasons Movers & Storage,info@allseasonsmove.com
All Seasons Packing,"All Seasons Packing is a moving and packing service based in Seattle that offers professional assistance for residential, corporate, and commercial moves. Their main functionality includes systematic packing protocols, secure transport, interior design, home staging, and specialized services like labor-only support and emergency relocation. They provide a transparent three-step moving process: assessing needs, preparing items, and ensuring proper handling of damages, all while prioritizing customer satisfaction through meticulous care and transparency.",https://www.instagram.com/allseasonspacking,+12067690187,All Seasons Packing,info@allseasonspacking.com
All Things New,"The website offers a range of services and resources for individuals seeking to create or manage their own living spaces, including home organization, personal development, and family planning. It provides tools for organizing living environments, such as storage solutions and furniture options, along with tips for stress management and financial literacy. Users can also access information on various categories like packing, moving, and insurance related to their needs. The site aims to support families in navigating the complexities of modern life through organized and creative living experiences.",,,All Things New,lamorse@allthingsnewwtn.com
Aloha Joe Movers LLC,"Aloha Joe Movers is a local moving company based in South King County, Washington. They offer professional moving services for residential and commercial clients, ensuring customer satisfaction through courteously and knowledgeable support. The company provides free estimates and features an informative moving tips page to help customers make informed decisions. Aloha Joe M Moving has been operating since 2008 and emphasizes quality service and community involvement.",https://www.linkedin.com/company/aloha-joe-movers,"+12064230041, +12537354099",Aloha Joe Movers,joe@alohajoemovers.com
Alta Moving & Storage,"Alta Moving & Storage is a moving and storage service based in Edmonton, Alberta. They offer a range of services including residential moves, commercial storage, packing, and portable storage solutions tailored to individual needs. Their team provides personalized support throughout the move process, ensuring secure and efficient handling of belongings, and offers flexible pricing options such as flat-rate truck fees and no hidden fees. Alta Moving also features specialized equipment like Frogbox for easy packing and unpacking.","https://www.facebook.com/altamoving, https://www.instagram.com/altamoving",+17803963000,Alta Moving & Storage,hello@altamoving.ca
American Made Moving,"American Made Moving is a moving company based in Pasadena, TX, offering a variety of moving services for residential and commercial clients. Their main functionalities include local and long-distance moving, packing, unpacking, and storage solutions, with options for one-hour moves, last-minute moves, and specialized services like furniture moving, senior move, and furniture handling. The company emphasizes customer satisfaction through professional service, including free estimates, scheduling, and assistance during the relocation process. They also provide insurance coverage for all moving-related expenses and have over 40 years of experience in the industry.",,"+18887114778, +17139655776",American Made Moving,info@americanmademoving.com
Available Movers Inc,"Available Movers Inc is a moving company based in Toronto that offers a range of moving services for both residential and commercial moves, including residential and long-distance relocations. Their main functionalities include residential moving, commercial moving, piano moving, car shipping, and packing services. They provide competitive pricing, reliable service with guaranteed arrival times, accurate estimates, and 24/7 availability to assist clients throughout the relocation process. The team consists of trained movers and drivers who prioritize customer satisfaction and quality service.",,+14379991515,Available Movers,info@amovers.ca
Green Gorilla Movers LLC,"Green Gorilla Movers is a moving company based in Anchorage, Alaska, offering local moving services for homes and offices. They provide delivery of furniture, appliances, and safe items, as well as short-term storage options for surplus or overflow items. The team focuses on customer service throughout the move process, ensuring timely arrival and efficient handling of belongings, including heavy household items like hot tubs and furniture.",https://www.linkedin.com/company/green-gorilla-movers-ak,+19078029600,Green Gorilla Movers,anchoragemovingco@gmail.com
Anne Arundel Movers,"Anne Arundel Movers is a moving company that offers a variety of services for residential, commercial, and long-distance moves in Maryland and surrounding areas. Their main functionality includes packing, unpacking, and storage solutions tailored to the needs of different types of belongings, such as furniture, gym equipment, and senior living. Key features include free estimates, personalized moving plans, custom packaging, and assistance with relocation processes like filing and insurance. The company emphasizes customer satisfaction and provides support throughout the move process.",,"+18887114778, +14433463786",Anne Arundel Movers,info@annearundelmovers.com
Arranged By Erin,"Ar arranged By Erin is a decluttering and organizing service based in Illinois. The main purpose of the service is to help clients create a clutter-free living space through tailored organizational solutions, including home organizing, office organization, relocation, and packing. Key features include personalized strategies based on client needs, expert guidance from Erin, and a focus on improving overall space management for individuals and businesses.","https://www.linkedin.com/company/arranged-by-erin, https://www.facebook.com/arranged-by-erin-professional-organizing-67980318636, https://twitter.com/arrangedbyerin, https://www.pinterest.com/erinorganized",+17734903760,Arranged By Erin,erin@arrangedbyerin.com
Atlantic Beach Movers,"Atlantic Beach Movers is a moving service provider based in Virginia Beach, VA, specializing in home and office moves. They offer a range of services including door-to-door transport, full packing, storage, and specialized move for items like pianos and fine art. The company emphasizes customer care, efficient dispatch, and transparent pricing with no hidden fees, ensuring that all aspects of the moving process are handled effectively by their experienced team.",,+17572285090,Atlantic Beach Movers,sales@atlanticbeachmovers.com
Austin Home Transitions,"Austin Home Transitions is a moving company that assists older adults and their families with various aspects of their relocation. They provide personalized support throughout the moving process, including emotional assistance, packing, unpacking, and transportation arrangements. The company focuses on reducing stress for clients by ensuring attention to detail and building strong relationships within the community.","https://www.linkedin.com/company/austin-home-transitions, https://www.facebook.com/austinhometransitions, https://www.instagram.com/austinhometransitions",+15127972445,Austin Home Transitions,liz@austinhometransitions.com
Austin Pro Moving Company,"Austin Pro Moving Company is a moving service based in Austin, TX, offering local and long-distance relocation support for homes, offices, and specialized items. Their main functionality includes organizing the entire move process, from packing and shipping to installation and maintenance of belongings. Key features include customized moving solutions for various needs such as luxury furnishings, senior living, and furniture relocations, along with experienced movers who prioritize careful handling and communication throughout the moving experience.",,,Austin Pro Moving,info@austinpromoving.com
