Name,Description,Social URLs,Phones,company_clean,Final Email
Lawton Moving & Storage,"Lawton Moving & Storage is a moving and storage service based in Warwick, RI, offering both residential and commercial moving solutions. They provide a range of services including packing, move preparation, long-distance moving, and full-service storage options such as furniture and appliances. With over 80 years of experience, their trained crews ensure the safe transport of belongings and offer discounts for seniors and military personnel, making it easier for clients to manage their moving needs efficiently. The company also provides free phone estimates and has a commitment to customer satisfaction throughout the moving process.","https://facebook.com/267565463098813, https://yelp.com/biz/lawton-moving-and-storage-warwick-7","+14013240454, +14012232324, +14019445894",Lawton Moving & Storage,lawtonmoving@cox.net
Lift My Boxes,"Lift My Boxes is a moving company that provides professional relocation services for residential and interstate moves across the USA. They offer a range of services including packing, unpacking, vehicle transportation, and specialized move-in/moveout assistance for various types of belongings such as apartments and large homes. The company focuses on creating a stress-free moving experience by handling logistics planning, ensuring safe handling of fragile items, and providing competitive pricing to help clients save up to 60% on their moving costs.",,+18334990939,Lift My Boxes,howdy@liftmyboxes.com
Lojik Van Lines,"Lojik Van Lines is a moving company that offers a range of services including long-distance moving, packing, and storage. They provide free quotes for moves by filling out an online form, which includes details such as dates, zip codes, and inventory of items. The company emphasizes customer satisfaction and aims to deliver quality moving solutions tailored to client needs, ensuring timely delivery and personalized service throughout the relocation process.",,+18779581575,Lojik Van Lines,info@lojikvanlines.com
LongDistanceMoving.com,"LongDistanceMoving.com is a moving service that provides certified and insured movers for long-distance moves across all 50 states in the United States. The platform offers guaranteed binding quotes with no hidden fees, ensuring customers receive an accurate price before their move. Key features include professional packing, loading, transport, unloading, storage, and assembly services, along with real-time updates on belongings during the relocation process. The company emphasizes customer satisfaction and guarantees competitive pricing without surprises or last-minute charges.","https://www.facebook.com/ldistancemove, https://www.facebook.com/mylongdistancemovers, https://twitter.com/ldistancemove, https://twitter.com/mylongdistancem, https://www.youtube.com/channel/UC79ku3NfiL0oogO-OfLxsdA","+12109032026, +18008784166, +18009604060, +18883094914",LongDistanceMoving.com,info@longdistancemoving.com
Love's Moving Service LLC,"Love's Moving Service is a moving company based in Topeka, Kansas, offering a variety of moving services for both residential and commercial clients. Their main functionalities include 24/7 emergency moving, full moving services, and specialized packing and transportation solutions. With over 25 years of experience, their team provides professional moving assistance, utilizes advanced technology, and focuses on customer service to ensure a smooth relocation process.",,+17852150502,Love's Moving Service,tlove@lovesmovingservice.com
Magic Piano Movers,"Magic Piano Movers is a professional moving service based in New York City that specializes in the safe and reliable relocation of pianos, including grand and console models. The company offers climate-controlled storage solutions and flexible scheduling to ensure a smooth move for clients. Additionally, they provide piano tuning services through connections with technicians in NYC. With over 10 years of experience, their trained staff ensures quality care while handling heavy items and delicate instruments.",https://www.facebook.com/magicpianomovers,"+17187859898, +19168750000, +19168752235, +19294004747",Magic Piano Movers,info@magicpianomovers.com
Maison Moving,"Maison Moving is a full-service moving company based in Southern California, specializing in residential, commercial, and international moves. They offer a range of services including packing, unpacking, storage, and transportation for items like furniture and heavy goods. The company employs background-checked movers and provides free quotes with no hidden fees, ensuring personalized service throughout the move process. With over 40 years of experience, Maison Moving has completed more than 60,000 moves for homeowners, renters, and businesses across Orange County and beyond.","https://www.linkedin.com/company/18320259, https://www.linkedin.com/company/maisonmoving, https://www.facebook.com/maisonmoving, https://twitter.com/maisonmoving, https://x.com/maisonmoving, https://www.youtube.com/@maisonmoving, https://www.yelp.com/biz/maison-moving-tustin","+17148325950, +18008325950",Maison Moving,info@maisonmoving.com
Man With A Truck Moving Company,"Man With A Truck Moving Company is a moving service that offers a range of solutions for residential and commercial moves in Los Angeles, Orange, San Diego, Seattle, and Temecula. Their main functionality includes providing packing, unpacking, and storage services, as well as last-minute moves and specialized move-in options like furniture assembly and security setup. Key features include all-inclusive pricing with no hidden fees, professional packaging, and the ability to handle both small and large moves efficiently. They also offer free onsite estimates and have a network of licensed movers available for various locations across California.","https://www.linkedin.com/company/man-with-a-truck-moving-company, https://twitter.com/mwat_moving, https://www.yelp.com/biz/man-with-a-truck-moving-company-los-angeles","+12108996313, +13109257859, +14159067735, +17146023870, +18004860190, +19168363670, +17133527058",Man With A Truck Moving,info@manwithatruckmoving.com
Master The Time LLC,"Master The Time offers fractional estate management, personal concierge services, and relocation consulting for families and professionals in Boston and surrounding areas. Their main functionality includes providing ongoing oversight of homes, maintenance schedules, and strategic planning for renovations and moving processes. Key features include a single point of contact for personalized support, expert move leadership, and tailored solutions that allow clients to focus on their core lives while ensuring efficient and secure living environments.","https://www.linkedin.com/company/master-the-time, https://www.facebook.com/masterthetime, https://www.instagram.com/master_the_time, https://www.youtube.com/@masterthetime365",+16172949132,Master The Time,info@masterthetime.com
Maverick Moving,"Maverick Moving is a moving service based in Gainesville, FL, offering local and long-distance moving solutions for homeowners, renters, and businesses. Their main functionality includes packing, transporting, and disassembly of items such as furniture, art, and medical equipment, as well as providing specialized services like piano relocations and last-minute assistance. Key features include fully equipped trucks, customizable moving plans, and a focus on safety with protective gear during the move process. They also offer flexible pricing options tailored to different moving needs and provide free estimates before each job.",,,Maverick Moving,info@maverickmovingco.com
McCann's Building Movers,"McCann's Building Movers is a family-owned company in Alberta that specializes in the relocation, lifting, and recycling of buildings. They offer services for various types of properties, including homes, historic structures, and small homes, with a focus on ensuring they meet specific moving needs such as floodwater removal and structural transportation. With over 65 years of experience, their team provides professional property lifting, material recycling, and project planning to streamline the moving process. The company also offers property sales and has a history of successful projects across Canada, emphasizing quality workmanship and customer satisfaction.","https://www.linkedin.com/company/mccann's-building-movers-ltd., https://www.facebook.com/mbmovers",,McCann's Building Movers,inquiries@mbmyyc.com
McKee Moving & Storage,"McKee Moving & Storage is a moving company based in Melfort, SK, operating since 1937. They offer a range of services including local and long-distance moving, commercial and office moves, government approved storage, full packing and unpacking services, and supplies for do-it-yourself packing. The company focuses on providing personalized service throughout the move process, ensuring smooth operations from planning to transport and offloading.",https://www.facebook.com/mcdermidmovingco,+13067521500,McKee Moving & Storage,mckee.moving@sasktel.net
Multi-Clean Solutions,"Multi-Clean Solutions offers professional cleaning services for both residential and commercial properties. Their main functionalities include move-in/move-out cleaning, deep cleaning, exterior window cleaning, garbage room cleaning, and solar panel cleaning. They provide tailored cleaning solutions that are safe, thorough, and hygienic, ensuring a clean environment for clients to enjoy their spaces without the hassle.",,"+13689999563, +18258828553",Multi-Clean Solutions,cleaning@mcsolutions.ca
"Meade Transport, Inc.","Meade Transport is a professional moving company based in the South Shore of Boston, MA, specializing in residential and commercial moves. They offer services such as full-service packing for individual items, specialized moving for fine furniture and specialty items like hot tubs and swim spas, and secure warehouse storage for larger belongings. With over 20 years of experience, Meade Transport provides personalized moving assistance and ensures that all belongings are well-maintained and properly packed before they arrive.","https://www.linkedin.com/company/meade-transport-company, https://www.facebook.com/meadetransport",,Meade Transport,info@meadetransport.com
MetroMovers Vancouver,"MetroMovers Vancouver is a professional moving company that offers a range of services for homes, long-distance moves, and office relocations. Their main functionality includes packing, transporting, and storing items safely and efficiently, as well as specialized services like piano moving and storage solutions. Key features include trained movers, fast response times, transparent pricing with no hidden fees, and a focus on customer support throughout the move process. They also provide specialized services for seniors and freight moving, ensuring a smooth transition for both homeowners and businesses.","https://www.facebook.com/metromoversvancouver, https://x.com/mover27393, https://ca.pinterest.com/metromoversvancouver",+18885875687,MetroMovers Vancouver,service@metropolitanmovers.ca
Metropolitan Brampton,"Metropolitan Brampton is a moving company that offers a range of relocation services for both residential and commercial clients in the Brampton area. Their main functionality includes house, local, long-distance, packing, unpacking, and storage solutions tailored to individual needs. Key features include personalized planning, expert assistance throughout the move process, secure handling of belongings, and fast delivery times, ensuring a stress-free transition for customers while maintaining high standards of safety and professionalism.","https://www.linkedin.com/company/metropolitanmovers, https://www.facebook.com/metropolitanbrampton, https://twitter.com/metrobrampton, https://x.com/metropolit86061, https://ca.pinterest.com/metropolitanbrampton2","+12898019243, +12898128096",Metropolitan Brampton,service@metropolitanmovers.ca
MI-BOX Portable Storage,"MI-BOX Maine offers portable moving and storage containers designed to simplify the move process for individuals and families. Customers can rent containers that hold various items, including furniture, appliances, and personal belongings, with options for both small and large sizes. The service includes a free online estimate, where certified movers assist in packing and storing the container, as well as additional services like home staging and selling. MI-BOX aims to eliminate traditional storage costs associated with truck rentals and transportation.",https://www.linkedin.com/company/mi-box-maine,+12078058840,MI-BOX Portable Storage,booking@miboxmaine.com
Mi-Box Mobile Storage & Moving,"Mi-Box is a moving and mobile storage service that offers safe and affordable solutions for household goods. Their containers are designed to withstand extreme conditions, featuring a patented level load system, duel foam core panels, and clean wood floors. Customers can choose from various sizes, including 16'ft x 8' x 8', and can book deliveries or pay online through the Mi-Box Client Hub. The company also provides additional services such as packing, shipping, and maintenance for their products.","https://www.facebook.com/mi-box-mobile-storage-bathurst-106152877721403, https://www.instagram.com/miboxbathurst, https://www.youtube.com/channel/UCQaDCiY-z4ZsKQ8jn_8JgtQ",+15065483192,Mi-Box Mobile Storage & Moving,mibox@johnsonmoving.ca
Mid-American Moving and Storage,"Mid-American Moving is a professional moving company based in Des Moines, IA, offering a range of moving services for both residential and commercial moves. Their main functionalities include local, long-distance, last-minute, heavy item move, furniture move, and safe relocation assistance. The company is fully licensed and insured, ensuring efficient service with trained movers who prioritize health and safety during the moving process. They provide free quotes and cater to various moving needs, including small moves, corporate relocations, and specialized moves for seniors and veterans.","https://www.facebook.com/83333midam, https://www.facebook.com/midamericanmovingiowa, https://www.instagram.com/midamericanmoving",+13174572008,Mid-American Moving and Storage,info@midamericanmoving.com
"Mighty Men Moving, Inc.","Mighty Men Moving, Inc. is a moving company that provides professional moving services in Northern Virginia and the DMV region, including Prince William County, Fairfax, Arlington, Alexandria, and surrounding areas. They offer a range of moving options for residential, commercial, and interstate relocations, as well as specialized services like full box packing, cargo van moving, and storage solutions. The team consists of trained movers who prioritize safety and efficiency, ensuring that all belongings are protected and handled with care. Customers can choose from hourly or flat-rate pricing without hidden fees, and the company emphasizes transparent communication throughout the moving process.","https://www.linkedin.com/company/mighty-men-moving, https://facebook.com/mightymenmovinginc, https://www.instagram.com/mightymenmoving, https://www.yelp.com/biz/mighty-men-moving-fairfax-3?osq=mighty+men+moving, https://www.yelp.com/biz/yourpage","+17035603358, +15613585266",Mighty Men Moving,info@mightymenmoving.com
Mile High Movers LLC,"MileHighMoversLLC is a moving company based in Lakewood that offers a range of services for residential and commercial moves. Their main functionalities include house moving, apartment moving, late notice moving, furniture assembly, local moving, and specialized relocation services like packing and storage. The team focuses on providing professional handling of belongings, ensuring safe and efficient transportation, and has over 15 years of experience and completed more than 5,5,000 projects for clients across the Gateway area.",,+17204252432,Mile High Movers,milehighmoversllc@gmail.com
Miller Moving Co.,"The website offers moving and delivery services, including residential, local, and long-distance moves. It provides a range of products such as furniture, clothing, home decor, and accessories for sale or rent. Users can easily obtain quotes for various moving needs through the site, including packing, storage, and insurance options. The company also emphasizes customer service and aims to deliver quality moving solutions at competitive prices.","https://www.facebook.com/millermovingco, https://www.instagram.com/millermoving",+16463851991,Miller Moving,andy@millermovingco.com
Ryans Express Moving,"Ryans Express Moving is a moving service based in Mill Valley, CA, offering a range of relocation solutions for homes, apartments, and commercial spaces. Their main functionality includes providing professional moving crews, packing, transportation, and storage services, with a focus on safety and professionalism. Key features include same-day and next-day moves, customizable team sizes, GPS tracking, and a flat rate pricing model to ensure transparent costs. They also offer specialized services such as piano moving, pool table relocations, and student move assistance.",,,Ryans Express Moving,info@millvalleymovers.com
Mr. Minar's Moving Magic LLC,"Mr. Minar's Moving Magic LLC is a moving service based in Seattle that offers professional moving solutions for residential, long-distance, and specialty moves. They provide full-service moving with one person or two magicians for small items, ensuring efficient packing and organization. Key features include same-day and specialized moves, transportation of heavy household items like pianos and fitness equipment, and the ability to handle various moving tasks efficiently. The company emphasizes customer satisfaction and guarantees competitive pricing, with all necessary tools and equipment included in their services.",https://www.facebook.com/minarmoving,,Mr. Minar's Moving Magic,mr.minar@minarmoving.com
Moderna Relocation,"Moderna Relocation is a service that assists individuals and businesses in relocating to the Pittsburgh region. It offers support for home buying, selling homes, and renting, as well as cultural and language training tailored to individual needs. The company focuses on helping clients navigate the complexities of moving to the area, ensuring they can focus on their job while finding suitable neighborhoods and communities. Moderna also provides resources such as guides and community engagement programs to enhance the relocation experience.",https://www.linkedin.com/company/moderna-relocation,+14125352616,Moderna Relocation,nevena@moderna.us
Modern Delivery & Moving,"Modern Delivery & Moving is a moving company based in Marion, Ohio, offering local and long-distance relocation services for homeowners, renters, and businesses. Their main functionality includes organizing the entire move process from packing, transportation, unloading, and storage to finishing it with proper care and coordination. Key features include specialized services for various types of moves, such as residential, commercial, and last-minute relocations, as well as specialized options like heavy furniture, senior mobility, and specialized items like pianos and pool tables. The company emphasizes careful handling, responsive communication, and adherence to established transportation guidelines to ensure safe and reliable service throughout the moving experience.",,,Modern Delivery & Moving,info@moderndeliveryandmovingohio.com
Modern Life Management,"Modern Life Management is a personal concierge firm that assists clients with various household tasks and professional organization. Their main services include organizing to-do lists, vacation planning, moving assistance, household maintenance, and home support. The company focuses on providing personalized service in a confidential manner while ensuring client satisfaction through efficient and effective management of their daily tasks. They operate from Vancouver and the Sea-to-Sky Corridor, offering remote services worldwide.",https://www.linkedin.com/company/modern-life-management,+16046497017,Modern Life Management,contact@modernlifemanagement.com
Modern Workspace Solutions,"Modern Workspace Solutions offers design, installation, and project management services for various industries including restaurants, healthcare, retail, and commercial spaces. Their main functionalities include certified office furniture installation, modular systems, and corporate relocation services. They also provide tailored design solutions for hospitality, healthcare facilities, and warehousing environments, ensuring functionality and aesthetics in workspaces. Additionally, ModInstall manages staging, installation of furniture, and final walkthroughs to support clients throughout the process.","https://www.linkedin.com/company/modlogics, https://www.instagram.com/modlogics",+16238535292,Modern Workspace Solutions,sales@modlogics.com
Monarch Transitions,"Monarch Transitions offers services to assist older adults and their families with relocation and aging in place (Aing in Place) processes. They provide personalized moving assistance, including major downsizing and home preparation, ensuring a smooth transition for seniors. Their first visit is free, and they focus on creating tailored move plans that reduce stress and improve the overall experience for clients during their moves. The company emphasizes customer satisfaction and aims to deliver quality service throughout the moving process.",https://www.facebook.com/monarchtransitions,"+12063538617, +12535073398",Monarch Transitions,tina@monarchtransitions.com
Mountaineer Moving,"Mountaineer Moving is a moving service that offers both local and long-distance relocation solutions. They provide a range of services including interstate moving, local relocations, specialty moves, furniture rearranging, and storage for fragile items. Their trained team focuses on creating customized moving plans to ensure smooth transitions, ensuring careful packing and transportation of belongings. Additionally, they offer specialized installations and logistics support tailored to the needs of interior designers and high-end furniture stores in the Bozeman and Missoula regions of Montana.","https://www.linkedin.com/company/mountaineer-moving, https://www.facebook.com/mountaineermoving, https://www.instagram.com/mountaineermovingco",+14062019580,Mountaineer Moving,management@mountaineermoving.com
Mountain Empire Movers,"Mountain Empire Movers is a moving company based in Johnson City that offers a range of services for both local and long-distance moves. Their main functionalities include packing and unpacking belongings, renting or transporting rental trucks, and providing local and international moving services. The team focuses on delivering professional service tailored to the specific needs of each client, ensuring efficient and satisfied outcomes throughout the move process.",,,Mountain Empire Movers,caleb@mountainempiremovers.com
Movefasa Moving,"Movefasa Moving is a moving company based in Kansas City that offers a variety of relocation services for both residential and commercial moves. Their main functionalities include local, long-distance, and specialized moving services such as apartment relocations, piano moving, and packing assistance. Key features include transparent pricing with no hidden fees, dedicated coordinators for each move, and a team of trained movers who handle all aspects of the moving process, including packing, storage, and transportation. The company serves multiple locations across Kansas City and surrounding areas, ensuring personalized service throughout the moving experience.","https://www.facebook.com/movefasamoving, https://www.youtube.com/channel/UCIcP9TPLihdlWLsJK8xpuOQ, https://www.yelp.com/biz/movefasa-moving-blue-springs",+18166560539,Movefasa Moving,josh@movefasamoving.com
Move It Away Today,"Move It Away Today is a moving company based in Freehold, NJ, that offers customized moving services for both residential and business moves. They provide a range of moving solutions including home packing, furniture rearranging, senior moving, and specialized moving for offices and apartments. The company emphasizes customer satisfaction by offering transparent pricing, professional movers who prioritize security and peace of mind during the move, and they also assist with packing, storage, and delivery services. Additionally, they offer free consultations to discuss individual moving needs and have a partner service called Take It Away Daycare for additional support.","https://www.linkedin.com/company/takeitawaytoday, https://www.facebook.com/takeitawaytoday, https://www.instagram.com/takeitawaytoday, https://twitter.com/takeitawaytoday, https://www.youtube.com/channel/UCypf-FrB_8GNIUK8tk81kVw","+17329557500, +18555046683, +18338648863",Move It Away Today,info@takeitawaytoday.com
The Spa Mover,"Northwind Spas is a service that specializes in the moving, installation, and repair of various types of spas, including Viking Spas and Coast Spas. They assist customers with moving their spas from homes to new locations in the greater Sacramento area, offering personalized advice and support throughout the move. The company also sells new and used spas at competitive prices and provides maintenance services for existing spas. Additionally, they offer pre-owned options and have a showroom for customers to view and customize their spis.",https://www.facebook.com/thespamover,"+19166285734, +19169457729",The Spa Mover,thespamover@movemyspa.com
