Name,Domain,Industry Groups,Description,Employees,Street,City,Country,company_clean,Final Email
Express Flooring,expressflooring.com,CONSTRUCTION:0.9,"Express Flooring offers a shop-at-home flooring installation service that allows homeowners to explore and purchase various flooring options, including carpet, luxury vinyl plank, hardwood, laminate, and tile. The company provides free in-home estimates, expert installation services, and a lifetime installation warranty. Their team of design consultants assists customers with selecting from hundreds of samples, ensuring quality and affordability for their homes. Express Flooring also features special promotions and financing options tailored to different budgets and needs.",51-200,4110 W Washington,Phoenix,US,Express Flooring,contact@expressflooring.com
Fehr & Peers,fehrandpeers.com,ENGINEERING:0.96,"Fehr & Peers is a transportation solutions company that specializes in planning and engineering for public and private sectors. They focus on creating safer and more effective transport systems that enhance community living. Their services include research and development (R&D) to address innovative challenges in transportation, as well as the creation of sustainable mobility solutions. The firm has worked with various cities across multiple states, emphasizing collaboration and innovation in their projects.",201-500,100 Pringle Avenue,Walnut Creek,US,Fehr & Peers,info@fehrandpeers.com
First Merchants Bank,firstmerchants.com,FINANCIAL_SERVICES:0.93,"First Merchants Bank offers a range of financial services for personal and business needs, including checking and savings accounts, credit cards, mortgages, loans, and online banking. The bank provides tools for managing finances through mobile apps, allowing customers to pay bills early and avoid overdrafts. Additionally, it features wealth management solutions, retirement planning, and various loan options tailored for small businesses and professionals, all supported by FDIC-insured services. First Merchants aims to enhance the financial wellness of diverse communities while ensuring customer service and support.",1001-5000,990 West Main Street,Peru,US,First Merchants Bank,customerservice@firstmerchants.com
FlexQube,flexqube.com,MANUFACTURING:0.9,"FlexQube offers a range of modular material handling solutions designed for various industries, focusing on automation and ergonomic control in material flow management. Their products include pallet and container carts, shelf carts, flow carts, and specialized units like lift runners and mother-daughter carts, all aimed at improving operational efficiency and reducing labor costs. FlexQube's systems are customizable to meet specific business needs, allowing for easy configuration and customization to fit different operations. The company also provides aftermarket services and has over 20 years of experience in the industry, serving more than 1,000 companies worldwide.",51-200,8 Mexico +52,Duncan,US,FlexQube,ejones@agvamerica.com
Flood Brothers,floodbrothers.net,SUPPLY_CHAIN_AND_PROCUREMENT:0.93,"Flood Brothers is a commercial moving company that provides a range of relocation services for businesses across various industries, including office furniture installation, laboratory moving, fitness equipment installation, and warehouse relocation. Their main functionality includes project-managed moving, storage solutions, and logistics support to ensure smooth transitions into new workspaces. Key features include certified installation by trained professionals, a network of transportation resources, and a commitment to timely and professional service throughout the moving process.",51-200,610 Waterfront Dr Sw,Atlanta,US,Flood Brothers,info@floodbrothers.net
Folo3,folio3.com,IT_SERVICES:0.95,"Fotografia is a photography studio that offers various photography services, including portrait photography, street photography, abstract photography, and filmography. The studio provides in-person and online courses for both beginners and experienced photographers, covering topics such as visual storytelling, editing, and cinematography. Additionally, it features an archive of personal portraits and global street photography collections that tell compelling stories through detailed images. Clients can book shooting sessions or workshops tailored to their specific needs, with flexible scheduling options available based on individual preferences.",501-1000,6701 Koll Center Parkway,Pleasanton,US,Folo3,aimarketing@folio3.com
Fry-Wagner Moving & Storage,fry-wagner.com,SUPPLY_CHAIN_AND_PROCUREMENT:0.93,"Fry-Wagner Moving and Storage is a logistics company that provides a range of moving and moving services for both residential and commercial clients. Their main functionalities include local, long-distance, international, and employee relocation, as well as warehousing, distribution, and installation services. Key features include customized relocation plans, nationwide inventory management, and the ability to handle over 1 million moves annually across the United States and internationally. The company emphasizes safety, quality service, and customer satisfaction through virtual surveys and expert guidance throughout the moving process.",51-200,3700 Rider Trail South,Earth City,US,Fry-Wagner Moving & Storage,integritymatters@unigroupinc.com
Gamer Packaging,gamerpackaging.com,"BUSINESS_PRODUCTS_AND_SERVICES:0.87, SUPPLY_CHAIN_AND_PROCUREMENT:0.12","Gamer Packaging provides custom packaging solutions for various industries, including food and beverage, pharmaceuticals, health and beauty, and consumer goods. Their services encompass initial concept development, quality assurance testing, and warehousing, ensuring that products meet high-quality standards throughout the supply chain. They offer a complete range of packaging solutions, from sourcing from manufacturers to creating unique canopies, and provide decorating services to enhance brand visibility and functionality. Additionally, Gamer Packages supports clients with flexible financing options and has experience working with children's charities and pet owners.",51-200,100 S 5Th St,Minneapolis,US,Gamer Packaging,gamer@gamerpackaging.com
Global Tech Solutions,globalts.com,IT_SERVICES:0.94,"Global Tech Solutions provides IT support and services for businesses across various industries, including healthcare, education, and retail. Their main functionalities include managed IT services, cybersecurity, cloud computing, hardware repair, and business continuity solutions. Key features encompass 24/7 help desk support, remote monitoring, network security, and tailored IT consulting to enhance operational efficiency and drive growth.",201-500,2964 New Jersey 311 Blvd Of The Americas,Lakewood,US,Global Tech Solutions,info@globalts.com
The Armstrong Company,goarmstrong.com,SUPPLY_CHAIN_AND_PROCUREMENT:1.0,"The Armstrong Company is a full-service moving, storage, and logistics company that provides comprehensive solutions for both residential and business moves. They offer a range of services including transportation, warehousing, and supply chain management to ensure the movement of goods across various locations worldwide. With over 68 years of experience, their team collaborates closely with clients to handle all aspects of the move process, from packing and storage to final delivery. The company also features resources such as checklists, blog posts, and customer support to assist with moving planning and operations.",501-1000,8275 Tournament Drive,Memphis,US,The Armstrong,info@goarmstrong.com
GoShare Inc.,goshare.co,SUPPLY_CHAIN_AND_PROCUREMENT:1.0,"GoShare is a same-day delivery and moving service that connects customers with vetted drivers for last mile deliveries, middle mile logistics, and moving across the United States. Users can easily book services through a mobile app, receive real-time updates on their shipments, and track their progress in one place. GoShare offers various vehicle types, including box trucks, cargo vans, and pickups, and provides flexible scheduling options to accommodate different needs. The platform utilizes machine learning for accurate pricing and has over 65,000 verified delivery professionals to ensure reliable service.",51-200,11440 W Bernardo Ct,San Diego,US,GoShare,customerservice@goshare.co
Graebel Companies Inc.,graebel.com,"HUMAN_RESOURCES:0.89, BUSINESS_PRODUCTS_AND_SERVICES:0.07","Graebel provides global relocation services and mobility solutions for employees, including executives and interns. Their main functionality is to support the entire relocation process through a range of services such as pre-decision support, departure services, destination assistance, settling in, and repatriation. Key features include a technology platform called Graebel CitySwitcher for seamless moving processes, customized talent mobility strategies, and tools that enhance visibility and efficiency during transitions. Graebels aims to create personalized experiences while optimizing program costs and ensuring diversity and inclusion.",1001-5000,16346 E Airport Cir,Aurora,US,Graebel Companies,securityofficer@graebel.com
Grafton,grafton.com,HUMAN_RESOURCES:1.0,"Grafton is a global recruitment and human resources (HR) service that connects companies with qualified professionals across various industries. The company offers solutions such as permanent recruitment, temporary hiring, talent acquisition consulting, and employer-of-record services. Grafton operates in multiple countries and provides insights on hiring trends, career changes, and organizational strategies to enhance employee engagement and productivity.",201-500,,Grafton,US,Grafton,it.privacy@gigroup.com
Guidepost,guidepostsolutions.com,BUSINESS_PRODUCTS_AND_SERVICES:1.0,"Guidepost is a law firm that provides investigations, compliance, security, and risk management services for various industries including education, healthcare, government, and finance. Its main functionality includes conducting corporate investigations, managing regulatory compliance, and providing cybersecurity consulting to help organizations identify risks and develop effective strategies. Key features include due diligence, technology advisory services, and specialized security solutions tailored for educational institutions, healthcare providers, and government agencies. The firm also offers training programs and resources to enhance organizational safety and operational efficiency.",201-500,100 Pringle Avenue,Walnut Creek,US,Guidepost,privacypolicy@guidepostsolutions.com
Handling Specialty,handling.com,MANUFACTURING:1.0,"Handling Specialty is a manufacturer of custom material handling equipment and systems, specializing in scissor lifts, rail equipment, work positioners, guided vehicles, and various lifting devices. The company offers engineering services for designing and installing tailored solutions for industries such as aerospace, automotive, energy, and manufacturing. Key features include a wide range of products like robotic lift systems, flooring hoists, conveyors, and hydraulic systems, along with maintenance services to ensure optimal operation and operational efficiency. Handling Specialty also provides parts and services for their equipment, including repairs, inspections, and training.",51-200,219 S Service Rd,Grimsby,CA,Handling Specialty,info@handling.com
HardingPoorman,hardingpoorman.com,ADVERTISING_AND_MARKETING:0.95,"HardingPoorman is a full-service print and brand communications company that offers a variety of services to enhance marketing efforts. Their main functionalities include commercial printing, on-demand printing, custom packaging, signage, direct mail, eCommerce solutions, fulfillment, inventory management, mobile engagement, and creative services. They focus on providing quality service with timely delivery, responsive communication, and tailored solutions for various industries such as retail, government, and healthcare.",51-200,4923 West 78Th Street,Indianapolis,US,HardingPoorman,ap@hardingpoorman.com
ITW Hartness,hartness.com,MANUFACTURING:0.9,"ITW Hartness provides packaging machinery and solutions designed to enhance the efficiency of secondary packaging across various industries, including food, beverage, and personal care. Their main offerings include Dynamic Accumulators for managing product flow, Mass Flow Accumulation systems for buffering and pressureless handling, and Case Packaging systems that support both standard and specialized needs. Additionally, ITW Hartnesses offers training, audits, and refurbishment programs to ensure optimal performance and customer satisfaction.",201-500,50 Beechtree Blvd.,Greenville,US,ITW Hartness,dslessman@hartness.com
"Higher Information Group, LLC.",higherinfogroup.com,IT_SERVICES:0.92,"Higher Information Group (HIG) provides a range of technology solutions for businesses in Pennsylvania and New York, focusing on office technology, IT services, document management, security, marketing, and marketing. Their main functionality includes optimizing technology strategies, enhancing security, and improving operational efficiency to help organizations reduce costs and improve safety. Key features include managed IT services for IT support, cloud solutions, document storage services, and integrated marketing strategies such as content development and website design. HIG aims to simplify technology selection and provide tailored solutions that align with clients' specific needs across various industries.",51-200,1316 College Avenue,Elmira,US,Higher Information Group,helpdesk@higherinfogroup.com
Hilldrup,hilldrup.com,SUPPLY_CHAIN_AND_PROCUREMENT:0.94,"Hilldrup is a moving, logistics, and workplace solutions company that offers a range of services for both residential and corporate relocation. Their main functionalities include local, long-distance, and international moving, as well as specialized warehousing, asset management, and employee mobility services. Hilldrup also provides transportation solutions such as freight forwarding, final mile delivery, and program management to ensure smooth operations across various industries including healthcare, retail, and government.",201-500,4022 Greenville Sc 750 Berry Shoals Road,Duncan,US,Hilldrup,hrgroup@hilldrup.com
International Association of Movers,iamovers.org,NONPROFIT_AND_PHILANTHROPY:1.0,"The International Association of Movers (IAM) is an organization that supports moving companies and suppliers in the global moving industry. It offers resources such as a directory for finding certified moving professionals, training programs, and tools to enhance operational efficiency and ethical standards. Key features include the IAMTrusted Moving Company program, e-learning courses, and access to a Mobility Exchange for tracking compliance issues and managing supplier information. Members can also participate in events like annual meetings and awards ceremonies to promote professional development and collaboration within the industry.",51-200,1600 Please Refer To The Table Below,Alexandria,US,International Association of Movers,membership@iamovers.org
International Industrial Contracting Corporation,iiccusa.com,CONSTRUCTION:0.89,"International Industrial Contracting Corporation (IICC) is a full-service industrial contracting company that specializes in the installation and relocation of heavy machinery and equipment across various industries, including automotive, manufacturing, transportation, and food and beverage. Their main services include project management, equipment maintenance, millwright services, steel services, and shutdown and turnaround operations. IICC focuses on providing quality workmanship and competitive pricing while ensuring safety and efficiency throughout their projects.",51-200,35900 Mound Road,Sterling Heights,US,International Industrial Contracting,info@iiccusa.com
Imlach Group,imlachgroup.com,SUPPLY_CHAIN_AND_PROCUREMENT:0.91,"Imlach Group is a moving company that provides residential, commercial, and corporate relocation services across the United States. They offer professionally managed moving solutions for homeowners, office and industrial relocations, local, long-distance, international, and specialized moves such as medical and laboratory relocations. Additionally, Imlach group provides logistics services including warehousing, distribution, and transportation, catering to projects like museum and fine art relocations and exhibitions. Established in 1924, they focus on delivering clear communication, careful handling, and predictable pricing to ensure smooth and efficient moving experiences.",51-200,28349 Fort St,Trenton,US,Imlach Group,imlachmovers@imlachgroup.com
"Iron Mountain, Inc.",ironmountain.jobs,SUPPLY_CHAIN_AND_PROCUREMENT:0.84,"Iron Mountain is a global information management company that provides various services including transportation, operations, sales, technology, and data center solutions. Its main purpose is to support businesses in enhancing their physical and digital information while ensuring compliance with industry standards. Key features include a diverse workforce across multiple sectors, a focus on sustainability, and a commitment to equal employment opportunities for individuals with disabilities. Iron Mountain also offers resources such as career development programs and a dedicated portal for customer support and payment processing.",10001+,,Iron Mountain,US,Iron Mountain,accommodationrequest@ironmountain.com
Kinetic Advantage,kineticadvantage.com,"FINANCIAL_SERVICES:0.72, REAL_ESTATE:0.06","Kinetic Advantage is an independent floorplan company that provides financing solutions for independent dealerships. Its main functionality includes offering flexible loan options such as consumer loans and buybacks, with terms up to 180 days. The company manages inventory through over 900 digital and physical auctions, allowing dealers to track their sales, manage titles, and access reporting tools. Additionally, Kinetic Advantage supports dealer-to-dealer purchases and trade-ins, helping dealerships grow by maintaining a healthy cash flow and improving operational efficiency.",51-200,10333 N. Meridian,Carmel,US,Kinetic Advantage,hello@kineticadvantage.com
Knowledge Anywhere,knowledgeanywhere.com,"EDUCATION:0.61, HUMAN_RESOURCES:0.18","Knowledge Anywhere is a centralized online training platform designed for businesses to manage and track their training programs. It offers features such as AI-driven assessments, course conversion tools, customizable training paths, eCommerce integration, and real-time compliance tracking. The platform supports over 60,000 professionally made courses and provides dedicated support for moving content, ensuring that organizations can effectively enhance employee engagement and knowledge retention.",51-200,2026 Ne 45Th St,Seattle,US,Knowledge Anywhere,support@knowledgeanywhere.com
KONE,kone.us,MANUFACTURING:0.92,"KONE is a global company that specializes in the design, installation, and maintenance of elevators and escalators for various industries, including residential, retail, office, hotels, and public sector. Their main functionality includes providing innovative elevator solutions, predictive maintenance services, and tools for building management. Key features include 24/7 service support, advanced people flow solutions, and a focus on sustainability through energy-efficient designs and retrofitting. KONE operates across more than 60 countries, ensuring reliable and efficient transportation for users.",51-200,3333 Warrenville Rd,Lisle,US,KONE,americas.customer-support@kone.com
"Liquidity Services, Inc.",liquidityservices.com,SUPPLY_CHAIN_AND_PROCUREMENT:1.0,"Liquidity Services provides solutions for managing surplus assets across various industries. Their main functionalities include asset sales and marketing, asset valuation, and direct retail solutions to convert customer returns into cash. They offer data-backed insights to help organizations maximize the value of their assets, manage auctions, and facilitate online transactions that allow customers to buy items in a secure manner.",501-1000,6931 Arlington Road,Bethesda,US,Liquidity Services,publicrelations@liquidityservices.com
Manning Group,manninggroup.com,"CONSTRUCTION:0.74, MANUFACTURING:0.14","Manning Group is a furniture services company based in Arizona that offers installation, relocation, and warehousing solutions. They specialize in custom-manufactured architectural walls, moveable walls, and turn-key management of commercial spaces such as offices and call centers. The company operates its own climate-controlled warehouse for efficient product handling and has a strong safety program with all employees certified. Manning Group also provides customer service support through multiple channels, including phone, email, and live chat.",51-200,75 East 16Th Street,Tucson,US,Manning Group,drewk@manninggroup.com
Matcom,matcom.com,"CONSTRUCTION:0.64, MANUFACTURING:0.29","Matcom Ontario is a contractor specializing in industrial machinery moving, rigging, and millwrighting. They provide services such as machinery moving (including complex mechanical installations), repairs, upgrades, parts sales, fabrication, lubrication systems, and warehousing solutions. With over 40 years of experience, Matcom focuses on delivering efficient and reliable service tailored to the needs of various industries, ensuring compliance with safety standards and timely project completion.",51-200,400 Parkhurst Square,Brampton,CA,Matcom,info@matcom.com
McCollister's,mccollisters.com,SUPPLY_CHAIN_AND_PROCUREMENT:0.95,"McCollister's Global Services provides specialized transportation and logistics solutions for various industries, including high-value electronics, medical equipment, and military relocations. Their offerings include auto transport and warehouse distribution, as well as a comprehensive solution for residential and commercial relocation needs. Key features include real-time tracking of shipments, service guarantees, and a focus on customer service to ensure efficient operations. The company operates across multiple locations and is recognized for its commitment to quality and reliability in the industry.",201-500,6751 West Schulte Road,Tracy,US,McCollister's,ithelp@mccollisters.com
Merchants Fleet,merchantsfleet.com,BUSINESS_PRODUCTS_AND_SERVICES:0.93,"Merchant Fleet is a fleet management company that provides tailored solutions for businesses of all sizes across various industries. Its main services include vehicle management, maintenance, remarketing, and vehicle leasing, along with telematics for tracking driver performance and cost control. The company offers a range of tools to optimize fleet operations, manage fuel supply chain efficiency, and support sustainability efforts, ensuring that vehicles remain operational and at peak performance. Merchants Fleet also emphasizes hands-on assistance and customer satisfaction through a strong team with over 60 years of experience in the industry.",501-1000,14 Central Park Drive,Hooksett,US,Merchants Fleet,leasecontact@merchantsfleet.com
MetCredit,metcredit.com,FINANCIAL_SERVICES:0.93,"MetCredit is a commercial and consumer debt collection agency that helps businesses recover outstanding accounts receivable. The service offers a streamlined process for individuals and small businesses, utilizing advanced technology such as AI algorithms to identify payment opportunities and predictive intelligence. MetCredit operates across Canada, providing 24/7 support, reporting delinquent or paid accounts to major credit bureaus, and ensuring compliance with legal requirements. Their goal is to increase cash flow and improve the overall success of debt recovery efforts.",51-200,1155 Boulevard Robert-Bourassa,Montreal,CA,MetCredit,privacycomm@metcredit.com
"Meyer, Inc.",meyerinc.com,SUPPLY_CHAIN_AND_PROCUREMENT:1.0,"Meyer is a logistics, relocation, and storage solutions company that provides services for various industries including corporate healthcare, education, and manufacturing. Its main functionalities include office moving, project management, furniture installation, and records management. Meyer also offers commercial storage solutions with flexible pricing options and operates multiple locations across the United States. The company focuses on delivering personalized service to help clients navigate their relocation needs effectively.",51-200,255 Long Beach Blvd.,Stratford,US,Meyer,information@meyerinc.com
Michigan Box Company,michiganbox.com,MANUFACTURING:0.91,"Michigan Box Co. specializes in custom corrugated packaging for various industries, including food and beverage, automotive, e-commerce, and retail. The company offers a range of services such as digital prototyping, box performance testing, assembly and fulfillment, and ready-to-ship packaging. They manage their own production lines and fleet, ensuring fast turnaround times and reliable quality for their clients' packaging needs. Michigan Box Co., also emphasizes sustainability by planting trees for every order they handle.",51-200,1910 Trombly Street,Detroit,US,Michigan Box,info@michiganbox.com
